serial_number,website_name,url,title,date,content
952,INDIA TODAY,https://www.indiatoday.in/education-today/gk-current-affairs/story/list-of-20-most-polluted-cities-in-the-world-1990041-2022-08-19?utm_source=global-search&utm_medium=global-search&utm_campaign=global-search,List of 20 most polluted cities in the world,"UPDATED: Aug 19, 2022 18:21 IST",Listen to Story
953,INDIA TODAY,https://www.indiatoday.in/cities/kolkata/story/kolkata-ranks-second-list-world-most-polluted-cities-1989403-2022-08-18?utm_source=global-search&utm_medium=global-search&utm_campaign=global-search,Kolkata ranks second in list of world's most polluted cities,"UPDATED: Aug 18, 2022 12:10 IST",Listen to Story
954,INDIA TODAY,https://www.indiatoday.in/cities/delhi/story/delhi-tops-list-world-most-polluted-cities-1989359-2022-08-18?utm_source=global-search&utm_medium=global-search&utm_campaign=global-search,Delhi tops list of world's most polluted cities,"UPDATED: Aug 18, 2022 11:19 IST",Listen to Story
955,INDIA TODAY,https://www.indiatoday.in/education-today/news/story/iit-delhi-and-koo-join-hands-to-drive-public-awareness-on-air-pollution-1984334-2022-08-05?utm_source=global-search&utm_medium=global-search&utm_campaign=global-search,IIT Delhi and Koo join hands to drive public awareness on air pollution,"UPDATED: Aug 5, 2022 21:09 IST",Listen to Story
956,INDIA TODAY,https://www.indiatoday.in/law/supreme-court/story/sc-refuses-to-hear-plea-alleging-delhi-govt-diverted-pollution-control-funds-to-adverts-1979768-2022-07-25?utm_source=global-search&utm_medium=global-search&utm_campaign=global-search,'Go to high court': SC tells petitioner alleging diversion of funds by Delhi govt,"UPDATED: Jul 25, 2022 18:06 IST",Listen to Story
958,INDIA TODAY,https://www.indiatoday.in/india/story/indians-air-pollution-report-air-quality-life-index-who-guidelines-1962533-2022-06-15?utm_source=global-search&utm_medium=global-search&utm_campaign=global-search,Indians losing 5 years of life due to air pollution: Report,"UPDATED: Jun 15, 2022 07:33 IST",Listen to Story
959,INDIA TODAY,https://www.indiatoday.in/environment/story/delhiites-hope-aap-govt-in-punjab-will-resolve-national-capital-air-pollution-issue-1958176-2022-06-04?utm_source=global-search&utm_medium=global-search&utm_campaign=global-search,Delhiites hope AAP govt in Punjab will resolve national capital's air pollution issue,"UPDATED: Jun 4, 2022 03:04 IST",Listen to Story
960,INDIA TODAY,https://www.indiatoday.in/diu/story/delhi-new-normal-air-pollution-not-just-in-winter-1958072-2022-06-03?utm_source=global-search&utm_medium=global-search&utm_campaign=global-search,The new abnormal: Air pollution is not just a winter thing in Delhi anymore | Deep Dive,"UPDATED: Jun 3, 2022 21:06 IST",Listen to Story
961,INDIA TODAY,https://www.indiatoday.in/cities/delhi/story/delhi-air-quality-may-poorest-last-three-years-central-pollution-control-board-1956927-2022-06-01?utm_source=global-search&utm_medium=global-search&utm_campaign=global-search,Delhi's air quality in May in 2022 poorest in last 3 years: Central Pollution Control Board,"UPDATED: Jun 1, 2022 12:57 IST",Listen to Story
962,INDIA TODAY,https://www.indiatoday.in/cities/delhi/story/delhi-news-trees-planted-2022-mcd-plantation-drive-1955950-2022-05-30?utm_source=global-search&utm_medium=global-search&utm_campaign=global-search,"Delhi: 85,000 trees to be planted in 2022 as part of civic body's plantation drive","UPDATED: May 30, 2022 12:12 IST",Listen to Story
963,INDIA TODAY,https://www.indiatoday.in/cities/gurugram/story/gurugram-breathes-satisfactory-air-after-nearly-four-months-1953848-2022-05-25?utm_source=global-search&utm_medium=global-search&utm_campaign=global-search,"Gurugram breathes 'satisfactory' air after nearly 4 months, AQI at 66","UPDATED: May 25, 2022 12:15 IST",Listen to Story
964,INDIA TODAY,https://www.indiatoday.in/cities/delhi/story/delhi-news-air-quality-satisfactory-category-three-months-1953771-2022-05-25?utm_source=global-search&utm_medium=global-search&utm_campaign=global-search,Delhi: Air quality in 'satisfactory' category after nearly 3 months,"UPDATED: May 25, 2022 09:52 IST",Listen to Story
965,INDIA TODAY,https://www.indiatoday.in/coronavirus-outbreak/story/air-pollution-severe-covid-hospitalisation-pollutants-study-1953450-2022-05-24?utm_source=global-search&utm_medium=global-search&utm_campaign=global-search,"Air pollution can lead to more severe Covid, finds study","UPDATED: May 24, 2022 14:50 IST",Listen to Story
966,INDIA TODAY,https://www.indiatoday.in/newsmo/video/pollution-killed-millions-in-india-over-2-3-million-indian-lives-were-claimed-by-pollution-in-2019-1952033-2022-05-20?utm_source=global-search&utm_medium=global-search&utm_campaign=global-search,Pollution Killed Millions In India: Over 2.3 million Indian Lives Were Claimed By Pollution In 2019,,"Pollution killed over 2.3 million Indians in 2019. Nearly 1.6 million deaths were just due to air pollution. The latest Lancet report on pollution and health unveiled such data. The report also blamed pollution for nine million premature deaths globally.
Read More"
967,INDIA TODAY,https://www.indiatoday.in/science/story/pollution-kills-2-4-million-people-a-year-in-india-9-million-globally-study-1950859-2022-05-18?utm_source=global-search&utm_medium=global-search&utm_campaign=global-search,"Pollution kills 2.4 million people a year in India, 9 million globally: Study","UPDATED: May 18, 2022 11:41 IST",Listen to Story
968,INDIA TODAY,https://www.indiatoday.in/india/story/india-urgent-action-tackle-air-pollution-who-1629437-2019-12-18?utm_source=global-search&utm_medium=global-search&utm_campaign=global-search,India should take urgent action to tackle air pollution: WHO,"UPDATED: Dec 18, 2019 20:50 IST",Listen to Story
969,INDIA TODAY,https://www.indiatoday.in/cities/delhi/story/dust-storm-heatwave-delhi-aqi-imd-weather-forecast-1940073-2022-04-21?utm_source=global-search&utm_medium=global-search&utm_campaign=global-search,"Dust storm, gusty winds in Delhi-NCR bring respite from heat","UPDATED: Apr 21, 2022 12:19 IST",Listen to Story
970,INDIA TODAY,https://www.indiatoday.in/cities/agra/story/from-vehicles-to-electricity-what-is-poisoning-agra-air-1939502-2022-04-20?utm_source=global-search&utm_medium=global-search&utm_campaign=global-search,"From vehicles to electricity, here's what is poisoning Agra's air","UPDATED: Apr 20, 2022 04:23 IST",Listen to Story
971,INDIA TODAY,https://www.indiatoday.in/india/story/no-respite-from-heat-in-upcoming-days-nights-to-get-hotter-study-1937040-2022-04-13?utm_source=global-search&utm_medium=global-search&utm_campaign=global-search,"No respite from heat in upcoming days, nights to get hotter: Study","UPDATED: Apr 13, 2022 17:30 IST",Listen to Story
972,INDIA TODAY,https://www.indiatoday.in/india/story/delhi-s-air-quality-severe-aqi-crosses-400-mark-1627612-2019-12-12?utm_source=global-search&utm_medium=global-search&utm_campaign=global-search,"Delhi's air quality severe, AQI crosses 400-mark","UPDATED: Dec 12, 2019 10:32 IST",Listen to Story
973,INDIA TODAY,https://www.indiatoday.in/india/story/chennai-ngo-says-tuticorin-air-quality-seen-significant-improvement-since-sterlite-plant-shut-down-1626891-2019-12-10?utm_source=global-search&utm_medium=global-search&utm_campaign=global-search,Chennai NGO says Tuticorin air quality seen significant improvement since Sterlite plant shut down,"UPDATED: Dec 10, 2019 10:54 IST",Listen to Story
974,INDIA TODAY,https://www.indiatoday.in/india/story/delhi-chokes-air-quality-index-very-poor-national-capital-1626085-2019-12-07?utm_source=global-search&utm_medium=global-search&utm_campaign=global-search,Delhi chokes: Air quality very poor in national capital,"UPDATED: Dec 7, 2019 11:30 IST",Listen to Story
975,INDIA TODAY,https://www.indiatoday.in/india/story/air-pollution-life-span-in-india-environment-minister-prakash-javadekar-1625903-2019-12-06?utm_source=global-search&utm_medium=global-search&utm_campaign=global-search,Pollution does not shorten life in India: Environment minister Prakash Javadekar says stop fear psychosis,"UPDATED: Dec 6, 2019 18:11 IST",Listen to Story
976,INDIA TODAY,https://www.indiatoday.in/technology/news/story/dyson-finds-harmful-chemicals-bacteria-insides-delhi-homes-1625129-2019-12-04?utm_source=global-search&utm_medium=global-search&utm_campaign=global-search,"Dyson finds harmful chemicals, bacterias, mites in homes in Delhi NCR","UPDATED: Dec 4, 2019 18:43 IST",Listen to Story
977,INDIA TODAY,https://www.indiatoday.in/india/story/delhi-ncr-air-quality-december-3-1624632-2019-12-03?utm_source=global-search&utm_medium=global-search&utm_campaign=global-search,Delhi chokes again as AQI level deteriorates to 'Very Poor' category,"UPDATED: Dec 3, 2019 10:47 IST",Listen to Story
978,INDIA TODAY,https://www.indiatoday.in/india/story/delhi-enjoys-cleanest-air-in-november-aqi-in-double-digits-1623593-2019-11-29?utm_source=global-search&utm_medium=global-search&utm_campaign=global-search,"Delhi enjoys cleanest air in November, AQI in double digits","UPDATED: Nov 29, 2019 11:48 IST",Listen to Story
979,INDIA TODAY,https://www.indiatoday.in/environment/story/uk-research-finds-excess-deaths-in-key-indian-cities-linked-to-air-pollution-1936278-2022-04-11?utm_source=global-search&utm_medium=global-search&utm_campaign=global-search,"Air pollution led to 100,000 premature deaths in India over 14 years, finds UK research","UPDATED: Apr 12, 2022 06:25 IST",Listen to Story
980,INDIA TODAY,https://www.indiatoday.in/cities/delhi/story/delhi-govt-14-point-summer-action-plan-against-pollution-to-start-from-april-12-1936179-2022-04-11?utm_source=global-search&utm_medium=global-search&utm_campaign=global-search,Delhi govt's 14-point summer action plan against pollution to start from April 12,"UPDATED: Apr 11, 2022 18:58 IST",Listen to Story
981,INDIA TODAY,https://www.indiatoday.in/movies/celebrities/story/chehre-emraan-hashmi-flies-to-delhi-for-final-shoot-schedule-says-he-will-need-a-gas-mask-1621750-2019-11-22?utm_source=global-search&utm_medium=global-search&utm_campaign=global-search,"Chehre: Emraan Hashmi flies to Delhi for final shoot schedule, says he will need a gas mask","UPDATED: Apr 7, 2022 11:07 IST",Listen to Story
982,INDIA TODAY,https://www.indiatoday.in/india/story/bjp-mp-gautam-gambhi-jalebi-delhi-pollution-controversy-exclusive-interview-jab-we-met-1621813-2019-11-22?utm_source=global-search&utm_medium=global-search&utm_campaign=global-search,"I am petrified of jalebis, says BJP MP Gautam Gambhir | EXCLUSIVE","UPDATED: Apr 7, 2022 11:07 IST",Listen to Story
983,INDIA TODAY,https://www.indiatoday.in/world/story/australia-bushfire-smoke-shoots-sydney-into-top-10-global-pollution-index-1621731-2019-11-22?utm_source=global-search&utm_medium=global-search&utm_campaign=global-search,Australia bushfire smoke shoots Sydney into top 10 global pollution index,"UPDATED: Apr 7, 2022 11:07 IST",Listen to Story
984,INDIA TODAY,https://www.indiatoday.in/world/story/sydney-gasps-air-australia-bushfire-smoke-reaches-record-levels-1621485-2019-11-22?utm_source=global-search&utm_medium=global-search&utm_campaign=global-search,Sydney gasps for air as Australia bushfire smoke reaches record levels,"UPDATED: Apr 7, 2022 10:56 IST",Listen to Story
985,INDIA TODAY,https://www.indiatoday.in/diu/story/delhi-air-quality-toxic-smoke-smog-cigarettes-1621410-2019-11-21?utm_source=global-search&utm_medium=global-search&utm_campaign=global-search,Children in Delhi smoke 10 cigarettes a day just by breathing,"UPDATED: Apr 6, 2022 19:01 IST",Listen to Story
986,INDIA TODAY,https://www.indiatoday.in/india/story/air-quality-delhi-improved-prakash-javadekar-rajya-sabha-1621395-2019-11-21?utm_source=global-search&utm_medium=global-search&utm_campaign=global-search,Air quality in Delhi improved in last 3 years: Prakash Javadekar to Rajya Sabha,"UPDATED: Apr 6, 2022 19:01 IST",Listen to Story
987,INDIA TODAY,https://www.indiatoday.in/diu/story/odds-against-odd-even-scheme-could-not-improve-delhi-s-air-1620985-2019-11-20?utm_source=global-search&utm_medium=global-search&utm_campaign=global-search,"Odds against odd-even, scheme could not improve Delhi's air","UPDATED: Apr 6, 2022 18:52 IST",Listen to Story
988,INDIA TODAY,https://www.indiatoday.in/mail-today/story/parliamentary-panel-takes-air-emergency-1621031-2019-11-21?utm_source=global-search&utm_medium=global-search&utm_campaign=global-search,Parliamentary panel takes up air emergency: What happened inside the meeting,"UPDATED: Apr 6, 2022 18:52 IST",Listen to Story
989,INDIA TODAY,https://www.indiatoday.in/mail-today/story/pollution-in-delhi-rocks-parliament-1620667-2019-11-20?utm_source=global-search&utm_medium=global-search&utm_campaign=global-search,Pollution in Delhi rocks Parliament,"UPDATED: Apr 6, 2022 18:17 IST",Listen to Story
990,INDIA TODAY,https://www.indiatoday.in/india/story/delhi-bjp-mps-blame-kejriwal-for-not-taking-steps-to-curb-pollution-1620606-2019-11-19?utm_source=global-search&utm_medium=global-search&utm_campaign=global-search,Delhi BJP MPs blame Kejriwal for not taking steps to curb pollution,"UPDATED: Apr 6, 2022 18:17 IST",Listen to Story
991,INDIA TODAY,https://www.indiatoday.in/india/story/aap-attacks-bjp-as-its-3-mps-miss-debate-on-air-pollution-1620573-2019-11-19?utm_source=global-search&utm_medium=global-search&utm_campaign=global-search,AAP attacks BJP as its 3 MPs miss debate on air pollution,"UPDATED: Apr 6, 2022 17:54 IST",Listen to Story
992,INDIA TODAY,https://www.indiatoday.in/india/story/epca-asks-delhi-ncr-authorities-to-step-up-pollution-surveillance-efforts-1620297-2019-11-18?utm_source=global-search&utm_medium=global-search&utm_campaign=global-search,EPCA asks Delhi-NCR authorities to step up pollution surveillance efforts,"UPDATED: Apr 6, 2022 17:54 IST",Listen to Story
993,INDIA TODAY,https://www.indiatoday.in/india/story/delhi-air-quality-index-november-19-pollution-in-lok-sabha-1620351-2019-11-19?utm_source=global-search&utm_medium=global-search&utm_campaign=global-search,Delhi air quality to deteriorate to Severe category by Thursday; pollution talks in Lok Sabha today,"UPDATED: Apr 6, 2022 17:54 IST",Listen to Story
994,INDIA TODAY,https://www.indiatoday.in/india/story/gautam-gambhir-will-quit-eating-jalebi-to-check-delhi-air-pollution-1620081-2019-11-18?utm_source=global-search&utm_medium=global-search&utm_campaign=global-search,"If my eating jalebi causes Delhi pollution, I'll quit jalebis: Gautam Gambhir's defence","UPDATED: Apr 5, 2022 19:05 IST",Listen to Story
995,INDIA TODAY,https://www.indiatoday.in/mail-today/story/delhi-pollution-scaring-rare-migratory-birds-winter-hotspots-1619929-2019-11-17?utm_source=global-search&utm_medium=global-search&utm_campaign=global-search,"Delhi: Pollution, trash dumping, encroachment scaring rare migratory birds from winter hotspots","UPDATED: Apr 5, 2022 19:01 IST",Listen to Story
996,INDIA TODAY,https://www.indiatoday.in/diu/story/stubble-burning-dips-in-north-india-satellite-data-show-1619716-2019-11-16?utm_source=global-search&utm_medium=global-search&utm_campaign=global-search,"Stubble burning dips in north India, satellite data show","UPDATED: Apr 5, 2022 18:18 IST",Listen to Story
997,INDIA TODAY,https://www.indiatoday.in/india/story/water-sprinklers-sweeping-vehicles-procured-west-bangal-board-roles-out-action-plan-tackle-air-pollution-1619590-2019-11-16?utm_source=global-search&utm_medium=global-search&utm_campaign=global-search,"Water sprinklers, sweeping vehicles procured: West Bengal board roles out action plan to tackle air pollution","UPDATED: Apr 5, 2022 18:18 IST",Listen to Story
998,INDIA TODAY,https://www.indiatoday.in/india/story/delhi-pollution-supreme-court-toxic-air-quality-odd-even-1619294-2019-11-15?utm_source=global-search&utm_medium=global-search&utm_campaign=global-search,"Delhi pollution: Half-baked odd-even no solution, how will people breathe, SC asks govt","UPDATED: Apr 5, 2022 18:13 IST",Listen to Story
999,INDIA TODAY,https://www.indiatoday.in/india/story/odd-even-rule-ends-delhi-number-violators-dips-this-time-1619484-2019-11-16?utm_source=global-search&utm_medium=global-search&utm_campaign=global-search,"Odd-Even rule ends in Delhi, number of violators dips this time","UPDATED: Apr 5, 2022 18:13 IST",Listen to Story
1000,INDIA TODAY,https://www.indiatoday.in/india/story/delhi-chokes-mps-key-officials-skip-high-level-meeting-on-pollution-called-by-parliament-committee-1619276-2019-11-15?utm_source=global-search&utm_medium=global-search&utm_campaign=global-search,"Delhi chokes: MPs, key officials skip meeting on pollution called by Parliamentary panel","UPDATED: Apr 5, 2022 17:58 IST",Listen to Story
1001,INDIA TODAY,https://www.indiatoday.in/india/story/bjp-leader-vijay-goel-hits-out-at-arvind-kejriwal-calls-odd-even-rule-a-drama-1618881-2019-11-14?utm_source=global-search&utm_medium=global-search&utm_campaign=global-search,"BJP leader Vijay Goel hits out at Arvind Kejriwal, calls odd-even rule a drama","UPDATED: Apr 5, 2022 16:07 IST",Listen to Story
1002,INDIA TODAY,https://www.indiatoday.in/india/story/odd-even-returns-after-three-day-break-552-violators-fined-1618661-2019-11-14?utm_source=global-search&utm_medium=global-search&utm_campaign=global-search,"Odd-even returns after three-day break, 552 violators fined","UPDATED: Apr 5, 2022 15:59 IST",Listen to Story
1003,INDIA TODAY,https://www.indiatoday.in/india/story/delhi-air-quality-aqi-western-disturbances-relief-pollution-friday-1618622-2019-11-13?utm_source=global-search&utm_medium=global-search&utm_campaign=global-search,Fresh western disturbance likely to provide relief from pollution by Friday,"UPDATED: Apr 5, 2022 15:59 IST",Listen to Story
1004,INDIA TODAY,https://www.indiatoday.in/india/story/delhi-air-pollution-schools-closed-epca-sc-panel-1618608-2019-11-13?utm_source=global-search&utm_medium=global-search&utm_campaign=global-search,Air pollution: SC panel orders closure of Delhi-NCR schools till November 15,"UPDATED: Apr 5, 2022 15:59 IST",Listen to Story
1005,INDIA TODAY,https://www.indiatoday.in/mail-today/story/delhi-chokes-how-agencies-failed-to-clean-up-13-toxic-hubs-in-city-1618325-2019-11-13?utm_source=global-search&utm_medium=global-search&utm_campaign=global-search,Delhi chokes: How agencies failed to clean up 13 toxic hubs in city,"UPDATED: Apr 5, 2022 15:16 IST",Listen to Story
1006,INDIA TODAY,https://www.indiatoday.in/india/story/toxic-delhi-air-sc-pulls-up-centre-says-find-ways-to-solve-pollution-problem-1618418-2019-11-13?utm_source=global-search&utm_medium=global-search&utm_campaign=global-search,"Toxic Delhi air: SC pulls up Centre, says find ways to solve pollution problem","UPDATED: Apr 5, 2022 15:16 IST",Listen to Story
1007,INDIA TODAY,https://www.indiatoday.in/india/story/delhi-ncr-air-quality-aqi-pollution-winds-stubble-burning-cpcb-1618260-2019-11-12?utm_source=global-search&utm_medium=global-search&utm_campaign=global-search,"Brace yourself Delhi, pollution likely to enter emergency zone on Wednesday","UPDATED: Apr 5, 2022 12:38 IST",Listen to Story
1008,INDIA TODAY,https://www.indiatoday.in/science/story/who-data-shows-99-per-cent-world-population-breathes-unhealthy-air-1933412-2022-04-04?utm_source=global-search&utm_medium=global-search&utm_campaign=global-search,New WHO data shows 99 per cent of world's population breathes unhealthy air,"UPDATED: Apr 4, 2022 19:08 IST",Listen to Story
1009,INDIA TODAY,https://www.indiatoday.in/india/story/delhi-air-pollution-creates-toxic-foam-on-yamuna-river-1616544-2019-11-07?utm_source=global-search&utm_medium=global-search&utm_campaign=global-search,After effects: Delhi air pollution creates toxic foam on Yamuna river,"UPDATED: Apr 1, 2022 15:04 IST",Listen to Story
1010,INDIA TODAY,https://www.indiatoday.in/india/story/kolkata-air-quality-dips-to-very-poor-category-1616464-2019-11-07?utm_source=global-search&utm_medium=global-search&utm_campaign=global-search,Kolkata's air quality dips to very poor category,"UPDATED: Apr 1, 2022 15:04 IST",Listen to Story
1011,INDIA TODAY,https://www.indiatoday.in/india/story/air-pollution-up-chief-secretary-faces-supreme-court-ire-1616420-2019-11-06?utm_source=global-search&utm_medium=global-search&utm_campaign=global-search,Don't want to know your name. What's the road map? SC to UP chief secy on pollution,"UPDATED: Apr 1, 2022 13:34 IST",Listen to Story
1012,INDIA TODAY,https://www.indiatoday.in/india/story/stubble-burning-supreme-court-punjab-haryana-uttar-pradesh-centre-1616418-2019-11-06?utm_source=global-search&utm_medium=global-search&utm_campaign=global-search,"Can you permit people to die due to pollution: SC chides states, Centre over toxic air","UPDATED: Apr 1, 2022 13:34 IST",Listen to Story
1013,INDIA TODAY,https://www.indiatoday.in/india/story/supreme-court-stubble-burning-air-quality-farmers-delhi-haryana-punjab-uttar-pradesh-1616350-2019-11-06?utm_source=global-search&utm_medium=global-search&utm_campaign=global-search,"Air pollution: Give farmers Rs 100/quintal to manage stubble, SC tells state govts","UPDATED: Apr 1, 2022 13:34 IST",Listen to Story
1014,INDIA TODAY,https://www.indiatoday.in/india/story/supreme-court-delhi-air-pollution-aqi-stubble-burning-1616270-2019-11-06?utm_source=global-search&utm_medium=global-search&utm_campaign=global-search,Aren't you ashamed sitting in ivory towers letting people die: SC to govts on Delhi air pollution,"UPDATED: Apr 1, 2022 13:34 IST",Listen to Story
1015,INDIA TODAY,https://www.indiatoday.in/india/story/kanpur-reels-under-poor-air-quality-and-pollution-1616252-2019-11-06?utm_source=global-search&utm_medium=global-search&utm_campaign=global-search,Kanpur reels under poor air quality and pollution,"UPDATED: Apr 1, 2022 13:34 IST",Listen to Story
1016,INDIA TODAY,https://www.indiatoday.in/mail-today/story/anti-smog-gun-could-combat-delhi-s-rising-pollution-levels-1616062-2019-11-05?utm_source=global-search&utm_medium=global-search&utm_campaign=global-search,Anti-smog gun could combat Delhi's rising pollution levels,"UPDATED: Mar 31, 2022 13:03 IST",Listen to Story
1017,INDIA TODAY,https://www.indiatoday.in/mail-today/story/odd-even-enters-day-3-delhi-air-gets-slightly-better-1616063-2019-11-06?utm_source=global-search&utm_medium=global-search&utm_campaign=global-search,"Odd-Even enters Day 3, Delhi air gets slightly better","UPDATED: Mar 31, 2022 13:03 IST",Listen to Story
1018,INDIA TODAY,https://www.indiatoday.in/india/story/odd-even-winds-bring-some-relief-delhi-air-quality-goes-from-severe-to-poor-1616103-2019-11-06?utm_source=global-search&utm_medium=global-search&utm_campaign=global-search,"Odd-Even, winds bring some relief: Delhi air quality goes from severe to poor","UPDATED: Mar 31, 2022 13:03 IST",Listen to Story
1019,INDIA TODAY,https://www.indiatoday.in/mail-today/story/green-tribunal-raps-delhi-govt-over-pollution-1616061-2019-11-05?utm_source=global-search&utm_medium=global-search&utm_campaign=global-search,Green tribunal raps Delhi govt over pollution,"UPDATED: Mar 31, 2022 13:03 IST",Listen to Story
1020,INDIA TODAY,https://www.indiatoday.in/india/story/delhi-smog-pollution-air-quality-winds-stubble-burning-farm-fire-1615967-2019-11-05?utm_source=global-search&utm_medium=global-search&utm_campaign=global-search,Strong winds reduced impact of highest farm fire count recorded Monday: SAFAR,"UPDATED: Mar 28, 2022 11:57 IST",Listen to Story
1021,INDIA TODAY,https://www.indiatoday.in/india/story/lucknow-air-quality-smog-pollution-masks-stubble-burning-1615946-2019-11-05?utm_source=global-search&utm_medium=global-search&utm_campaign=global-search,Masks distributed to people in Lucknow as air quality continues to remain toxic,"UPDATED: Mar 28, 2022 11:57 IST",Listen to Story
1022,INDIA TODAY,https://www.indiatoday.in/india/story/delhi-ncr-s-dirty-fuel-driven-industries-to-remain-shut-till-nov-8-epca-1615732-2019-11-05?utm_source=global-search&utm_medium=global-search&utm_campaign=global-search,Delhi-NCR's dirty fuel-driven industries to remain shut till Nov 8: EPCA,"UPDATED: Mar 25, 2022 18:55 IST",Listen to Story
1023,INDIA TODAY,https://www.indiatoday.in/india/story/air-pollution-sc-bans-construction-demolition-burning-of-waste-in-delhi-ncr-1615731-2019-11-05?utm_source=global-search&utm_medium=global-search&utm_campaign=global-search,"Air pollution: SC bans construction, demolition, burning of waste in Delhi-NCR","UPDATED: Mar 25, 2022 18:55 IST",Listen to Story
1024,INDIA TODAY,https://www.indiatoday.in/india/story/delhi-more-patients-with-respiratory-ailments-visit-hospitals-as-city-chokes-1615729-2019-11-05?utm_source=global-search&utm_medium=global-search&utm_campaign=global-search,Delhi: More patients with respiratory ailments visit hospitals as city chokes,"UPDATED: Mar 25, 2022 18:55 IST",Listen to Story
1025,INDIA TODAY,https://www.indiatoday.in/india/story/delhi-air-pollution-aap-bjp-prakash-javadekar-cancelled-meetings-1615706-2019-11-04?utm_source=global-search&utm_medium=global-search&utm_campaign=global-search,AAP asks why Prakash Javadekar cancelled 3 environment meetings before Delhi pollution hit hard,"UPDATED: Mar 25, 2022 18:55 IST",Listen to Story
1026,INDIA TODAY,https://www.indiatoday.in/india/story/no-civilised-country-can-live-like-this-sc-pulls-up-centre-aap-govt-on-delhi-pollution-1615715-2019-11-04?utm_source=global-search&utm_medium=global-search&utm_campaign=global-search,"No civilised country can live like this: SC pulls up Centre, AAP govt on Delhi pollution","UPDATED: Mar 25, 2022 18:55 IST",Listen to Story
1027,INDIA TODAY,https://www.indiatoday.in/india/story/air-quality-deteriorates-in-lucknow-varanasi-other-cities-of-up-1615723-2019-11-04?utm_source=global-search&utm_medium=global-search&utm_campaign=global-search,"Air quality deteriorates in Lucknow, Varanasi, other cities of UP","UPDATED: Mar 25, 2022 18:55 IST",Listen to Story
