serial_number,website_name,url,title,date,content
18,Times of India,https://timesofindia.indiatimes.com/city/gurgaon/grap-iv-curbs-back-to-halt-gurgaon-in-its-tracks-again/articleshow/117276178.cms,GRAP-IV curbs back to halt Gurgaon in its tracks again,,"Gurgaon: The city's air quality sharply deteriorated on Wednesday as the air quality index (AQI) shot up to 270 (poor) from Tuesday's 156 (moderate). Experts attributed the deterioration in AQI to local factors and low wind speeds.
Among the four AQI monitoring stations in the city, Sector 51 and Gwal Pahari reported ‘very poor' AQI readings of 327 and 366, respectively. Vikas Sadan AQI was at 116. Teri Gram readings were unavailable due to insufficient data.
The PM2.5 level peaked in Gwalpahari (365), followed by Vikas Sadan (346 µg/m³), Teri Gram (328 µg/m³), and Sector-51 (310 µg/m³), according to the CPCB data.
PM10 levels were highest in Sector-51 (365 µg/m³), followed by Gwal Pahari (302 µg/m³), whilst Vikas Sadan station failed to record PM10 data. According to CPCB, the annual average permissible limits for PM2.5 and PM10 are 60 µg/m³ and 100 µg/m³, respectively.
  BY TABOOLA
SPONSORED LINKS
YOU MAY LIKE
How to Trade in Commodity Market's Like a Pro?
TradeWise
Learn More
In response to the deteriorating air quality, the Commission for Air Quality Management (CAQM) in NCR and adjoining areas implemented both GRAP-III and GRAP-IV measures on Wednesday. For the first time this season, restrictions under both the stages were invoked in the same order.
Under GRAP-III and IV include restricting truck traffic entry into Delhi, except for trucks carrying essential commodities or providing essential services. However, LNG/CNG/Electric/BS-VI Diesel trucks are permitted. Strict prohibition is imposed on Delhi-registered diesel-operated BS-IV and below Heavy Goods Vehicles (HGVs), except those carrying essential commodities or providing essential services. Construction and demolition activities are prohibited, including linear public projects such as highways, roads, flyovers, overbridges, power transmission, pipelines, and telecommunication projects. The restrictions mandate hybrid mode classes for students from class 6 to 9 and 11 in the territorial jurisdiction of the NCT of Delhi and the districts of Gurgaon, Faridabad, Ghaziabad, and Gautam Budh Nagar."
19,Times of India,https://timesofindia.indiatimes.com/city/noida/noidas-aqi-slips-back-to-poor-grap-iv-back-in-place/articleshow/117272926.cms,"Noida’s AQI slips back to ‘poor’, GRAP IV back in place",,"Noida: The city woke up to a blanket of dense fog on Wednesday morning, reducing visibility to near zero until 8.30am and disrupting daily life. Commuters faced difficulties navigating the roads due to poor visibility. Two private buses also collided due to the haze on the Noida Expressway, with three commuters sustaining injuries.
According to an IMD official, Western UP recorded zero visibility from midnight to 8.30 am. ""The visibility increased thereafter. The forecast shows a similar zero visibility situation for Thursday in Noida and Ghaziabad, with the possibility of thunderstorms/lightning at isolated places,"" the official said.
Sumit Kumar, who was commuting from Noida to Greater Noida's Pari Chowk around 8am on his bike on Wednesday, told TOI, ""There was nearly zero visibility on the roads, and obstacles, road signs, vehicles, etc, were not visible. I parked my bike near Botanical Garden and waited for one hour for the visibility to improve, and then I drove.""
Meanwhile, the air quality deteriorated further into the ‘poor' category in Noida on Wednesday. Noida recorded an AQI of 285 against Tuesday's 191 (moderate). Greater Noida, however, saw marginal improvement with an AQI of 222, compared to 252 the day before. Meanwhile, Ghaziabad's air quality slipped even further into the ‘very poor' category at 316 from 194 the day before.
  BY TABOOLA
SPONSORED LINKS
YOU MAY LIKE
Get a ₹2CR Life Cover at just ₹889/month today with Axis Max Life
Axis Max Life Insurance
Get Quote
As a result of the deteriorating air quality, the Commission for Air Quality Management (CAQM) on Wednesday evening implemented measures under GRAP stages III and IV simultaneously across Delhi-NCR, banning construction and demolition activities, and BS III and BS IV (diesel) vehicles, etc.
Meanwhile, air monitoring stations across the two districts recorded AQI ranging from ‘moderate' to ‘very poor' on Wednesday.
In Noida, Sector 62 station recorded the worst AQI at 356, followed closely by Sector 1 at 339 – both in the ‘very poor' category. Meanwhile, Sector 116 and Sector 125 both recorded ‘poor' AQI at 240 and 207, respectively. In Greater Noida, Knowledge Park 5 recorded ‘poor' AQI at 259, while Knowledge Park 3 recorded 180 in the ‘moderate' category.
In Ghaziabad, Indirapuram recorded the worst AQI at 342, followed closely by Vasundhara at 204 and Loni at 301 – all three in the ‘very poor' category. Data from the Sanjay Nagar station was not available on Wednesday.
The Indian Institute of Tropical Meteorology (IITM) attributed the deterioration in air quality to poor wind speed. It said that on Wednesday, the predominant surface wind came from the northeast direction with a wind speed of less than 6 kmph until evening. It decreased thereafter, becoming less than 4 kmph during the night.
""On Thursday, the city will record wind from the north direction with a wind speed of less than 4 kmph during morning hours. The wind speed will gradually increase thereafter, becoming 6-8 kmph from the northeast direction during the afternoon. There is also the possibility of a spell of very light rain during morning hours and a partly cloudy sky on Thursday,"" it said.
As per IMD data, the maximum and minimum temperatures were recorded at 18.1 degrees Celsius and 6 degrees Celsius on Wednesday."
20,Times of India,https://timesofindia.indiatimes.com/city/delhi/air-india-issues-advisory-for-travel-to-and-from-delhi-ahead-of-republic-day/articleshow/117258927.cms,Air India issues advisory for travel to and from Delhi ahead of Republic Day,,"NEW DELHI: Air India on Wednesday issued an important advisory for its passengers about to travel to and from Delhi, during the Republic Day (January 26) celebrations, urging them to maintain a buffer in their commute time and check the status of their flights before leaving for the airport.

""#ImportantUpdate Passengers travelling to and from Delhi between 19 & 26 Jan 2025, are requested to allow themselves more time and check the status of their flights before heading to the airport, due to Republic Day restrictions,"" the airline said in a post on social media platform X .
""For any further assistance, connect with our contact centre,"" it added. In another travel advisory posted earlier in the day, Air India had said, ""Poor visibility due to dense fog and airport congestion may affect flight operations in Delhi and some other cities today.""
  BY TABOOLA
SPONSORED LINKS
YOU MAY LIKE
""2 Most Profitable Trading Strategy in 2024"" by Hiral
TradeWise
Learn More
The advisory came as a thick layer of fog covered parts of Delhi early in the morning, significantly reducing visibility across the city. The city is experiencing cold waves, which are contributing to elevated levels of air pollution.
The Air quality in the national capital plummeted to the 'very poor' category. According to the Central Pollution Control Board (CPCB), the AQI was recorded at 344 in Delhi today at 7 am. Yesterday, at the same time, it was 252. According to CPCB data, Lodhi Road recorded an AQI of 287 (IITM) and 291 (IMD).
Major Dhyan Chand National Stadium reported 368, Mandir Marg 378, Mundka 372, and NSIT Dwarka 242. Najafgarh recorded 255, Narela 377, Nehru Nagar 394, and North Campus, DU 382 (IMD). Okhla Phase-2 reported an AQI of 380, Patparganj 390, and Pusa recorded 355. RK Puram reported an AQI of 373, Rohini 399, Shadipur 313, and Sirifort 360.
Sonia Vihar recorded 315, Sri Aurobindo Marg 222, Vivek Vihar 414, and Wazirpur 408. The data highlights that Vivek Vihar recorded the highest AQI of 414, indicating severe pollution levels. An AQI between zero and 50 is considered 'good,' 51 and 100 'satisfactory,' 101 and 200 'moderate,' 201 and 300 'poor,' 301 and 400 'very poor,' and 401 and 500 'severe.'"
21,Times of India,https://timesofindia.indiatimes.com/city/visakhapatnam/andhra-pradesh-pollution-control-board-takes-action-against-universal-biofuels-for-air-pollution-in-kakinada/articleshow/116774741.cms,Andhra Pradesh pollution control board takes action against Universal Biofuels for air pollution in Kakinada,,"Pawan Kalyan has directed authorities to conduct inspections in industries which are spreading stinking smell in Kakinada coast.
KAKINADA: The Pollution Control Board of Andhra Pradesh has taken drastic action on the directions of the Andhra Pradesh deputy chief minister Pawan Kalyan on in industry which is spreading pollution in the surrounding villages of Universal Biofuels Private Limited.
AP deputy chief minister and environmental and forest minister K Pawan Kalyan has directed the Pollution Control Board authorities to conduct inspections in industries which are spreading stinking smell in Kakinada coast. He told them that the people living in the surrounding areas of are suffering due to emanating of pollution and foul smell from Universal Biofuels Private Limited situated in Kakinada industrial area.
Responding to the emanating of foul smell for the last few days from the industry, Pawan Kalyan spoke to Pollution Control Board chairman Krishnayya and PCB, Kakinada regional officer Shankar Rao on phone. He has directed the PCB officials to inspect on whether the Universal Biofuels Private Limited is taking odour control steps or not and submit the report. He made it clear that the steps should be taken to make sure that people should not suffer from air pollution.
Talking to the TOI, Executive Engineer, PCB, Shanka Rao said hat the PCB has conducted inspections in the industry on 20th and 21th of the month and found the usage of raw material against the guidelines which is casing release of foul smell creating air pollution. He explained that the inspection was conducted on 20th and 21st in in the industry and they have found fault with the usage of raw material which is being used in the industry that crating foul smell.
  BY TABOOLA
SPONSORED LINKS
YOU MAY LIKE
Get a ₹2CR LifeCover at ₹889/month today with Axis Max Life.
Axis Max Life Insurance
Get Quote
He further said that the PCB had issued notices to the Universal Biofuels Private Limited to stop the usage of prohibited substnce which is creating air pollution. He said that the industry is using acid oil in the making of bio-fuels which is not permissible. The PCB has issued Show cause notice to the industry and they have stopped using acid oil. He mentioned that the the procedure would be fallowed s per the rules. Right now, he said that the production in the industry has bee stopped.
In another development, Pawan Kalyan has noted that large number of Olive Ridley sea turtles are perishing on Kakinada beach, APIIC and Vakalapudi areas. In this connection, the minister has directed Principal Conservator of Forest &Head of Forest Force, Chirnanjeevi Chowdary to investigate on the reasons for the death of the turtles and action on the responsible persons. He has further directed for the comprehensive study for the protection of wild life."
22,Times of India,https://timesofindia.indiatimes.com/city/gurgaon/unfair-to-blame-haryana-punjab-farmers-for-delhis-severe-pollution-ashok-khemka/articleshow/117214569.cms,Unfair to blame Haryana & Punjab farmers for Delhi’s severe pollution: Ashok Khemka,,"Gurgaon: Additional chief secretary Ashok Khemka has defended farmers in a note to CM Nayab Singh Saini and chief secretary Vivek Joshi, saying that while burning ‘parali' (paddy residue) negatively affects air quality and should be stopped, it is unfair to hold crop growers of Punjab and Haryana responsible for Delhi's severe air pollution.
The senior IAS officer, who is ACS transport, referred to a video conference of Jan 4 under the chairmanship of the PM's advisor, Tarun Kapoor, in which the chairman of Commission for Air Quality Management (CAQM) made a presentation on the subject.
The presentation was based on a Jan 2023 report by The Energy and Resources Institute (TERI), which said agricultural residue burning contributes 1% to PM 2.5 and PM10 levels in Delhi. This finding was displayed in a slide labeled ‘Sectoral Contribution of Sources of NCR to Particulate Matter'. Khemka's note, titled ‘Management of Air Pollution in NCR', was sent on Jan 10. According to the TERI report Khemka referred to, road dust contributes 42% to PM10 levels in Delhi annually while transport contributes 25%. Transport accounts for 47% of PM 2.5 emissions and road dust 20%. There is a higher contribution of dust sources to PM10 in summer (38-42%) compared to winter (23-31%). It's the same for PM 2.5 (31-34% in summer to 15% in winter).
Why annual data doesn't give a clear picture
  BY TABOOLA
SPONSORED LINKS
YOU MAY LIKE
Get a ₹2CR LifeCover at ₹889/month today with Axis Max Life.
Axis Max Life Insurance
Get Quote
However, while the ACS stresses the importance of having a strategy to contain vehicular pollution, farm fire emissions cannot be compared to vehicular or any other pollution source that is an all-year phenomenon.
Farm fires are seasonal, happening within a window between Sept 1 and Nov 30. So, their share in an annual metric will always be small. Besides, during the peak season for farm fires, their share in the capital's pollution levels are much, much higher than 1%.
According to the Decision Support System (DSS) for air quality management in Delhi, which has been used to monitor the contribution of farm fires to the capital's PM 2.5 levels, stubble burning's contribution touched 35% on Nov 1 last year.
Every winter, air quality in Delhi-NCR plummets to hazardous levels as the airshed fills up with toxic haze which is triggered by a combination of pollutants, fog, lack of winds and other meteorological factors. Farm fires, commonly seen in north India's agricultural belt to clear tracts of land for another round of sowing after the paddy harvest, become a major compounding factor when added to local sources.
Shubhansh Tiwari, research associate at Centre for Science and Environment (CSE), told TOI: ""Agricultural residue burning's overall contribution is small compared to other sources as it occurs for a limited period. The issue needs to be addressed because, during the 45 days when farmers clear their fields, meteorological conditions carry the smoke into NCR. Nevertheless, road dust and vehicular emissions remain primary contributors to particulate matter in Delhi-NCR and effective management of these sources, especially during the summer months when dust levels are higher, is crucial for improving air quality. So what we need is a holistic approach that addresses all significant pollution sources."""
23,Times of India,https://timesofindia.indiatimes.com/city/kolkata/air-quality-improves-in-some-kol-pockets-some-zones-stay-poor/articleshow/117210260.cms,"Air quality improves in some Kol pockets, some zones stay ‘poor’",,"1
2
Kolkata: The city experienced significant fluctuations in its air quality index (AQI) on Monday, with some monitoring stations recovering through the day from the bad air conditions on Sunday. The Rabindra Bharati University (RBU) air quality station on B T Road emerged as the city's most polluted zone, recording AQI levels that consistently fell within the ‘poor' category (AQI: 201-300). In contrast, Rabindra Sarobar and Victoria Memorial Hall stations showed improvement as the day progressed.
The RBU station, which has historically maintained the best air quality in the city, recorded a steep rise in pollution levels, peaking at 275 AQI by 7 pm. This marks a significant departure from its usual status, as it managed to maintain ‘moderate' air quality (AQI: 101-200) even when other stations plunged into the poor range earlier this year.
Jadavpur, which recorded poor air quality on Sunday, showed notable recovery to the ‘moderate' category on Monday. The AQI at Jadavpur started at 189 in the morning, dipped to 174 by midday, and rose slightly to 191 by evening.
In south Kolkata, Ballygunge's air quality worsened steadily over the day. It began with an AQI of 261 at 5 am and peaked at 263 by 7 pm, marking it as one of the most polluted zones. However, nearby Rabindra Sarobar saw its AQI improve from 174 in the morning to 153 by evening, maintaining moderate air quality. Victoria Memorial Hall recorded a decline in AQI from 272 at 5 am to 217 by 7 pm, indicating marginal improvement, though it was still within the poor range.
  BY TABOOLA
SPONSORED LINKS
YOU MAY LIKE
Get a ₹2CR Life Cover at just ₹889/month today with Axis Max Life
Axis Max Life Insurance
Get Quote
Across the city, most continuous ambient air quality monitoring stations reported progressive deterioration as the day advanced. Salt Lake's AQI was a moderate 194 in the morning but rose to 229 by evening. Fort William showed consistent poor air quality throughout the day, with AQI levels ranging from 234 to 232.
A WBPCB scientist highlighted the dangers of particulate matter (PM2.5), which can penetrate deep into the lungs and bloodstream, posing health risks."
24,Times of India,https://timesofindia.indiatimes.com/city/mumbai/iit-k-presents-fresh-plan-for-aqi-monitoring-units/articleshow/117179829.cms,IIT-Kanpur presents fresh plan for AQI monitoring units,,"MUMBAI: A team from IIT-Kanpur has presented a fresh proposal regarding the installation of hyperlocal sensor-based air quality monitoring units for evidence-based intervention to mitigate air pollution.
The civic body initially planned to install the sensors in association with IIT-Kanpur and then, considering logistical issues, pursued a tie-up with IIT-Bombay. However, with a delayed response from IIT-Bombay, the BMC sought a fresh proposal from IIT-Kanpur.
A fresh proposal was given by IIT-Kanpur Professor Sachchida Nand Tripathi, a professor of civil engineering and sustainable energy engineering, and his team, which includes start-ups. ""We are examining the proposal,"" said a civic official. ""The elements of the fresh proposal are not significantly different from the earlier one,"" said an official. The installation of the hyperlocal air quality monitoring units is expected to cost around Rs 13 crore.
""The earlier plan was to install 250 sensors across the city. However, the BMC now intends to install about 75 sensors, and the city will be divided into equal-sized grids of about eight square kilometres. The sensor-based air quality monitoring units would be set up at each of these grids. The monitoring units are expected to help BMC in measuring air quality at granular hyperlocal levels,"" said an official.
  BY TABOOLA
SPONSORED LINKS
YOU MAY LIKE
Get a ₹2CR LifeCover at ₹889/month today with Axis Max Life.
Axis Max Life Insurance
Get Quote
The sensors, which will help with hyperlocal monitoring of air quality, will be linked to the dashboard at the BMC headquarters and will help the civic body carry out hyperlocal action and mitigation measures. The sensor-based air quality monitoring devices can transmit data via cellular and Wi-Fi to the server and a dashboard at the BMC headquarters, where the data will be analysed,"" said an official connected to the project.
The dashboard for the hyperlocal monitoring system will be multi-layered and will have real-time analytics embedded into it. Data from these hyperlocal monitoring units will be infused into the system along with data from AQI monitoring units installed at construction sites across the city.
BMC will be able to identify the sources of pollution in real-time. Besides, the BMC will also be able to carry out real-time mitigation action at the local level, the official said. The IIT-Kanpur team set up sensor-based monitoring units across Bihar and part of UP and in several cities."
25,Times of India,https://timesofindia.indiatimes.com/india/stage-3-grap-order-lifted-in-delhi-ncr-as-air-quality-improves-amid-light-rains/articleshow/117175492.cms,Stage-3 GRAP order lifted in Delhi-NCR as air quality improves amid light rains,,"Light rains improved air quality in Delhi
NEW DELHI: The central panel overseeing Delhi-NCR's air quality revoked Stage-III restrictions under GRAP on Sunday, as pollution levels decreased due to suitable weather conditions, as per an official directive. A western disturbance brought light rain to Delhi and surrounding areas, enhancing the region's air quality.
""The AQI of Delhi has been recorded as 278 at 4:00 PM today which is 72 points below the 350 mark to implement the Stage-III as per the extant directives of the Hon’ble Supreme Court. Further, the forecast by IMD predicts another WD (Western Disturbance) in the region around 14th-15th January, 2025. ""The Sub-Committee, accordingly, decided to revoke its orders dated 09.01.2025, for invoking actions under Stage-III (‘Severe’ Air Quality) of the Schedule of GRAP (Revised December, 2024), with immediate effect,"" said the Commission for Air Quality Management (CAQM), the Sub-Committee on GRAP, in its order.
Poll
Do You Support the Use of GRAP to Tackle Air Pollution?
No, It Doesn’t Address the Root Causes
Yes, It's an Effective Approach

The order further stated that GRAP 1 and GRAP 2 will still remain in effect. ""Actions under Stage-I & II of the revised GRAP shall, however, remain invoked and be implemented, monitored, and reviewed by all the agencies concerned in the entire NCR to ensure that the AQI levels do not slip further. All implementing agencies shall keep strict vigil and especially intensify measures under Stage-I & II of the revised GRAP,"" stated the order.
  BY TABOOLA
SPONSORED LINKS
YOU MAY LIKE
Get a ₹2CR LifeCover at ₹889/month today with Axis Max Life.
Axis Max Life Insurance
Get Quote
The panel also urged that, ""While GRAP Stage-III is being revoked, keeping in view the winter season when weather conditions may not always be favorable, and in order to ensure that the AQI levels do not slip further, citizens are requested to strictly adhere to the citizen charter under GRAP-II.""
""The Sub-Committee shall be keeping a close watch on the air quality scenario and reviewing the situation from time to time for further appropriate decisions depending upon the Air Quality in Delhi and forecasts made by IMD/IITM,"" it further read.

Stage-III measures, reinstated on Thursday, prohibit non-essential construction work. Schools up to grade five are allowed to offer hybrid learning (online and in-person). BS-III petrol and BS-IV diesel four-wheelers, excluding those used by people with disabilities, are also restricted while older diesel-powered medium goods vehicles are banned in Delhi under Stage III.
The GRAP outlines four stages of air quality: Stage I (Poor), Stage II (Very Poor), Stage III (Severe), and Stage IV (Severe Plus). Another weather system is expected to impact northwest India around January 14-15. Winter air pollution in the Delhi-NCR region is caused by a combination of weather patterns, vehicle exhaust, agricultural burning, fireworks, and other local sources."
