serial_number,website_name,url,title,date,content
317,INDIA TODAY,https://www.indiatoday.in/cities/delhi/story/delhi-air-pollution-level-aqi-aap-civil-volunteers-bus-marshals-lg-vk-saxena-2622583-2024-10-24?utm_source=global-search&utm_medium=global-search&utm_campaign=global-search,Delhi to hire civil defence volunteers to implement pollution control measures,"UPDATED: Oct 24, 2024 17:47 IST",Listen to Story
318,INDIA TODAY,https://www.indiatoday.in/india/story/stubble-burning-cases-decline-doesnt-end-delhi-air-quality-woes-analysis-report-2622487-2024-10-24?utm_source=global-search&utm_medium=global-search&utm_campaign=global-search,Stubble burning cases decline but doesn't end Delhi's air quality woes: Analysis,"UPDATED: Oct 24, 2024 15:13 IST",Listen to Story
319,INDIA TODAY,https://www.indiatoday.in/cities/delhi/video/delhis-air-quality-worsens-as-stubble-burning-increases-to-21-2622291-2024-10-24?utm_source=global-search&utm_medium=global-search&utm_campaign=global-search,Delhi's air quality worsens as stubble burning increases to 21%,,"Delhi's air quality is declining, attributed to a 21 per cent rise in stubble burning in nearby states. Over 1,400 farm fires have been reported in the past 24 hours. Delhi Chief Minister Atishi points fingers at Haryana and Uttar Pradesh amidst the rising pollution in Delhi.
Read More"
320,INDIA TODAY,https://www.indiatoday.in/india/video/india-sees-21-rise-in-stubble-burning-this-year-data-shows-2622215-2024-10-24?utm_source=global-search&utm_medium=global-search&utm_campaign=global-search,"India sees 21% rise in stubble burning this year, data shows",,"Data reveals a significant 21 per cent increase in stubble burning incidents across India this year, with 1,400 farm fires recorded in the past day. This surge is contributing to Delhi's worsening air quality. Delhi AQI was recorded at 390 at 8 am on Thursday.
Read More"
321,INDIA TODAY,https://www.indiatoday.in/cities/delhi/story/delhi-air-pollution-aqi-quality-lt-governor-vk-saxena-chief-minister-atishi-meeting-2622372-2024-10-24?utm_source=global-search&utm_medium=global-search&utm_campaign=global-search,"Delhi Lt Governor to chair key meet on pollution today, Chief Minister to attend","UPDATED: Oct 24, 2024 13:25 IST",Listen to Story
322,INDIA TODAY,https://www.indiatoday.in/cities/delhi/story/delhi-aqi-air-quality-pollution-very-poor-category-diwali-severe-2622232-2024-10-24?utm_source=global-search&utm_medium=global-search&utm_campaign=global-search,Delhi's air quality continues to remain in 'very poor' category ahead of Diwali,"UPDATED: Oct 24, 2024 09:22 IST",Listen to Story
323,INDIA TODAY,https://www.indiatoday.in/cities/delhi/story/delhi-air-quality-new-delhi-municipal-council-parking-fee-hike-measures-air-pollution-2622175-2024-10-24?utm_source=global-search&utm_medium=global-search&utm_campaign=global-search,Parking fee hike among measures taken by Delhi civic body to curb air pollution,"UPDATED: Oct 24, 2024 01:34 IST",Listen to Story
324,INDIA TODAY,https://www.indiatoday.in/cities/delhi/story/delhi-air-pollution-lt-governor-vk-saxena-atishi-aap-air-quality-2622039-2024-10-23?utm_source=global-search&utm_medium=global-search&utm_campaign=global-search,"'Branded most polluted city again', Delhi Lt Governor writes to Chief Minister","UPDATED: Oct 23, 2024 22:57 IST",Listen to Story
325,INDIA TODAY,https://www.indiatoday.in/environment/story/no-relief-for-delhi-as-stubble-burning-fire-pushes-air-quality-toward-severe-levels-2621906-2024-10-23?utm_source=global-search&utm_medium=global-search&utm_campaign=global-search,No relief for Delhi as stubble burning pushes air quality toward severe levels,"UPDATED: Oct 23, 2024 16:49 IST",Listen to Story
326,INDIA TODAY,https://www.indiatoday.in/india/law-news/story/supreme-court-blasts-centre-as-air-quality-worsens-in-delhi-pollution-stubble-burning-penalty-mechanism-environment-act-2621699-2024-10-23?utm_source=global-search&utm_medium=global-search&utm_campaign=global-search,Will take you to task: Supreme Court blasts Centre as Delhi air quality worsens,"UPDATED: Oct 23, 2024 16:08 IST",Listen to Story
327,INDIA TODAY,https://www.indiatoday.in/cities/delhi/story/delhi-air-quality-worsens-ahead-of-diwali-many-areas-severe-category-aqi-crosses-400-2621665-2024-10-23?utm_source=global-search&utm_medium=global-search&utm_campaign=global-search,"Delhi air quality worsens ahead of Diwali, many areas in 'severe' category","UPDATED: Oct 23, 2024 11:01 IST",Listen to Story
328,INDIA TODAY,https://www.indiatoday.in/diu/story/stubble-burning-punjab-haryana-farmers-air-pollution-air-quality-2621405-2024-10-22?utm_source=global-search&utm_medium=global-search&utm_campaign=global-search,"Stubble burning: Punjab has slowed down, but Haryana hasn't!","UPDATED: Oct 22, 2024 20:13 IST",Listen to Story
329,INDIA TODAY,https://www.indiatoday.in/india-today-insight/story/from-the-india-today-archives-2015-delhi-capital-punishment-2621244-2024-10-22?utm_source=global-search&utm_medium=global-search&utm_campaign=global-search,From the India Today archives (2015) | Delhi: Capital punishment,"UPDATED: Oct 22, 2024 19:03 IST",Listen to Story
330,INDIA TODAY,https://www.indiatoday.in/information/story/delhi-air-pollution-grap-stage-2-invoked-in-delhi-ncr-all-you-need-to-know-2621179-2024-10-22?utm_source=global-search&utm_medium=global-search&utm_campaign=global-search,Delhi Air Pollution: GRAP stage 2 invoked in Delhi-NCR; All you need to know,"UPDATED: Oct 22, 2024 16:28 IST",Listen to Story
331,INDIA TODAY,https://www.indiatoday.in/cities/delhi/story/delhi-pollution-air-quality-restrictions-stubble-burning-vehicle-emissions-2621127-2024-10-22?utm_source=global-search&utm_medium=global-search&utm_campaign=global-search,Delhi's stubble burning pollution to increase over threefold tomorrow,"UPDATED: Oct 22, 2024 14:58 IST",Listen to Story
332,INDIA TODAY,https://www.indiatoday.in/programme/india-s-agenda/video/anti-pollution-restrictions-imposed-in-delhi-as-air-quality-worsens-to-very-poor-2620994-2024-10-22?utm_source=global-search&utm_medium=global-search&utm_campaign=global-search,Anti-pollution restrictions imposed in Delhi as air quality worsens to 'very poor',,"The second stage of Graded Response Action Plan (GRAP), the anti-pollution restrictions, announced by the central watchdog, came into force in Delhi on Tuesday, as the air quality in the city remained in the 'very poor' category for the second consecutive day.
Read More"
333,INDIA TODAY,https://www.indiatoday.in/cities/delhi/story/delhi-air-quality-aqi-level-pollution-measures-restrictions-stubble-burning-2620898-2024-10-22?utm_source=global-search&utm_medium=global-search&utm_campaign=global-search,"Delhi air quality remains 'very poor', anti-pollution restrictions imposed","UPDATED: Oct 22, 2024 11:04 IST",Listen to Story
334,INDIA TODAY,https://www.indiatoday.in/india/story/delhi-air-quality-aqi-pollution-smog-fog-very-poor-stubble-burning-winter-season-2620877-2024-10-22?utm_source=global-search&utm_medium=global-search&utm_campaign=global-search,"Delhi air quality to worsen, remain in 'very poor' category till October 24","UPDATED: Oct 22, 2024 08:16 IST",Listen to Story
335,INDIA TODAY,https://www.indiatoday.in/india/story/toxic-white-froth-yamuna-river-delhi-satellite-images-2620697-2024-10-21?utm_source=global-search&utm_medium=global-search&utm_campaign=global-search,Seen from space: Toxic white froth in Delhi's Yamuna,"UPDATED: Oct 21, 2024 19:32 IST",Listen to Story
336,INDIA TODAY,https://www.indiatoday.in/india/video/yamuna-delhi-pollution-aqi-2619224-2024-10-18?utm_source=global-search&utm_medium=global-search&utm_campaign=global-search,"Frothy Yamuna, smog-covered Delhi: Winter is coming",,"Delhi's air quality is deteriorating, with the Air Quality Index (AQI) recorded at 293 on Friday, marking it as ‘poor.’
Read More"
337,INDIA TODAY,https://www.indiatoday.in/cities/delhi/story/grap-2-restrictions-delhi-aqi-very-poor-construction-diesel-generators-2620636-2024-10-21?utm_source=global-search&utm_medium=global-search&utm_campaign=global-search,"Delhi restricts diesel generators, construction as air quality dips to 'very poor'","UPDATED: Oct 21, 2024 19:06 IST",Listen to Story
338,INDIA TODAY,https://www.indiatoday.in/cities/delhi/story/delhi-air-pollution-smog-fog-aqi-very-poor-stubble-burning-diwali-2620255-2024-10-21?utm_source=global-search&utm_medium=global-search&utm_campaign=global-search,"Delhi's air quality worsens to 'very poor', thick layer of fog engulfs city","UPDATED: Oct 21, 2024 10:32 IST",Listen to Story
339,INDIA TODAY,https://www.indiatoday.in/cities/delhi/story/delhi-yamuna-froth-air-pollution-air-quality-weather-update-2620134-2024-10-20?utm_source=global-search&utm_medium=global-search&utm_campaign=global-search,Toxic Yamuna froth: Why foam covers river and its effect on Delhi's air quality,"UPDATED: Oct 20, 2024 23:12 IST",Listen to Story
340,INDIA TODAY,https://www.indiatoday.in/india/story/delhi-pollution-air-quality-uttar-pradesh-buses-anand-vihar-isbt-diesel-cng-atishi-2620149-2024-10-20?utm_source=global-search&utm_medium=global-search&utm_campaign=global-search,"Influx of buses from Uttar Pradesh worsens air quality in Delhi, says Atishi","UPDATED: Oct 20, 2024 20:22 IST",Listen to Story
341,INDIA TODAY,https://www.indiatoday.in/cities/delhi/video/aap-only-knows-how-to-blame-others-delhi-congress-chief-on-citys-pollution-2620113-2024-10-20?utm_source=global-search&utm_medium=global-search&utm_campaign=global-search,AAP only knows how to blame others: Delhi Congress chief on city's pollution,,"Delhi’s air quality remained in the ""poor"" category on Sunday, with an Air Quality Index (AQI) of 265, according to data from the Central Pollution Control Board. On Saturday, the AQI was 278, slightly lower than Friday’s 292.
Read More"
342,INDIA TODAY,https://www.indiatoday.in/environment/story/delhi-air-pollution-air-quality-index-stubble-burning-2620098-2024-10-20?utm_source=global-search&utm_medium=global-search&utm_campaign=global-search,"Delhi air quality to worsen, stubble burning's role to increase by 4 times","UPDATED: Oct 20, 2024 18:30 IST",Listen to Story
343,INDIA TODAY,https://www.indiatoday.in/india/video/video-atishi-blames-bjps-dirty-politics-for-increasing-pollution-in-delhi-2619986-2024-10-20?utm_source=global-search&utm_medium=global-search&utm_campaign=global-search,Video: Atishi blames BJP's 'dirty politics' for increasing pollution in Delhi,,"Delhi Chief Minister Atishi on Sunday blamed the BJP for the rising pollution level in the national capital, stating that BJP's ""cheap politics"" as the main reason for the air and water pollution.
Read More"
344,INDIA TODAY,https://www.indiatoday.in/information/story/delhi-gurugram-amritsar-crackers-ban-ahead-of-diwali-2619962-2024-10-20?utm_source=global-search&utm_medium=global-search&utm_campaign=global-search,"Delhi, Haryana and Punjab push crackers ban before Diwali","UPDATED: Oct 20, 2024 13:21 IST",Listen to Story
345,INDIA TODAY,https://www.indiatoday.in/cities/delhi/story/delhi-air-quality-index-aqi-aap-bjp-blame-game-yamuna-pollution-gopal-rai-weather-2619873-2024-10-20?utm_source=global-search&utm_medium=global-search&utm_campaign=global-search,"Blame game over Delhi pollution, BJP accuses AAP of inaction since 10 years","UPDATED: Oct 20, 2024 08:41 IST",Listen to Story
346,INDIA TODAY,https://www.indiatoday.in/cities/delhi/story/delhi-air-quality-pollution-due-stubble-burning-indian-institute-of-tropical-meteorology-data-2619789-2024-10-20?utm_source=global-search&utm_medium=global-search&utm_campaign=global-search,Only 1% of Delhi's pollution is due to stubble burning. What is ailing city air?,"UPDATED: Oct 20, 2024 01:21 IST",Listen to Story
347,INDIA TODAY,https://www.indiatoday.in/cities/delhi/video/delhis-air-quality-hits-very-poor-category-as-pollution-worsens-2619533-2024-10-19?utm_source=global-search&utm_medium=global-search&utm_campaign=global-search,Delhi's air quality hits 'very poor' category as pollution worsens,,"The Air Quality Index (AQI) in Delhi's Anand Vihar has been recorded at 334, which is classified as ""very poor"" as the national capital yet again grapples with pollution.
Read More"
348,INDIA TODAY,https://www.indiatoday.in/cities/delhi/story/delhi-air-quality-very-poor-category-thick-smog-covers-national-capital-2619537-2024-10-19?utm_source=global-search&utm_medium=global-search&utm_campaign=global-search,"Delhi turns hazy as thick smog covers capital, air quality dips to 'very poor'","UPDATED: Oct 19, 2024 08:45 IST",Listen to Story
349,INDIA TODAY,https://www.indiatoday.in/environment/story/delhi-air-quality-very-poor-next-few-days-india-meteorological-department-stubble-burning-2619392-2024-10-18?utm_source=global-search&utm_medium=global-search&utm_campaign=global-search,"Air quality remains 'poor' in Delhi, will coming days be better or worse?","UPDATED: Oct 18, 2024 22:28 IST",Listen to Story
350,INDIA TODAY,https://www.indiatoday.in/india/story/bhagwant-mann-stubble-burning-punjab-farmers-delhi-air-pollution-northern-india-2619250-2024-10-18?utm_source=global-search&utm_medium=global-search&utm_campaign=global-search,"If PM can stop Ukraine war, can't he stop smoke? Bhagwant Mann on stubble burning","UPDATED: Oct 18, 2024 17:43 IST",Listen to Story
351,INDIA TODAY,https://www.indiatoday.in/cities/delhi/video/air-quality-in-delhi-ncr-worsens-due-to-stubble-burning-ytvd-2618957-2024-10-18?utm_source=global-search&utm_medium=global-search&utm_campaign=global-search,Delhi-NCR faces poor air quality due to stubble burning,,"Air quality in Delhi NCR has worsened due to stubble burning and firecrackers, causing the AQI to drop to 293, moving it from moderate to poor. This decline poses health risks, particularly for seniors and children. Efforts, including emergency meetings, are being made to tackle the problem, but a resolution is still pending.
Read More"
352,INDIA TODAY,https://www.indiatoday.in/cities/delhi/story/delhi-pollution-new-delhi-municipal-council-ndmc-fines-government-construction-sites-dust-control-violations-2618133-2024-10-17?utm_source=global-search&utm_medium=global-search&utm_campaign=global-search,Delhi's civic body fines 30 government construction sites for dust violations,"UPDATED: Oct 17, 2024 04:30 IST",Listen to Story
353,INDIA TODAY,https://www.indiatoday.in/diu/story/stubble-burning-air-pollution-punjab-haryana-kharif-harvesting-season-2617962-2024-10-16?utm_source=global-search&utm_medium=global-search&utm_campaign=global-search,"Stubble trouble: Punjab's controlling its crop burning, but Haryana isn't!","UPDATED: Oct 16, 2024 20:10 IST",Listen to Story
354,INDIA TODAY,https://www.indiatoday.in/environment/video/delhi-air-pollution-stubble-burning-supreme-court-2617891-2024-10-16?utm_source=global-search&utm_medium=global-search&utm_campaign=global-search,Hazy winters ahead as stubble burning rises—farmers cite 'machinery shortage',,"As winter nears, Delhi is once again grappling with rising air pollution. The Supreme Court on Wednesday criticised Punjab and Haryana, stating they have taken little effective action against stubble burning—a major contributor to the city’s pollution.
Read More"
355,INDIA TODAY,https://www.indiatoday.in/information/story/indias-least-polluted-cities-2617719-2024-10-16?utm_source=global-search&utm_medium=global-search&utm_campaign=global-search,India's least polluted cities,"UPDATED: Oct 16, 2024 13:00 IST",Listen to Story
356,INDIA TODAY,https://www.indiatoday.in/india/law-news/story/delhi-air-pollution-stubble-burning-supreme-court-blasts-pulls-up-punjab-haryana-2617661-2024-10-16?utm_source=global-search&utm_medium=global-search&utm_campaign=global-search,"Complete defiance: Supreme Court blasts Punjab, Haryana over Delhi air pollution","UPDATED: Oct 16, 2024 11:56 IST",Listen to Story
357,INDIA TODAY,https://www.indiatoday.in/cities/delhi/story/delhi-news-air-quality-index-pollution-weather-condition-2617564-2024-10-16?utm_source=global-search&utm_medium=global-search&utm_campaign=global-search,Delhi air quality improves to 'moderate' category after 2 days,"UPDATED: Oct 16, 2024 04:14 IST",Listen to Story
358,INDIA TODAY,https://www.indiatoday.in/information/story/delhi-pollution-grap-i-restrictions-and-ban-all-you-need-to-know-2617092-2024-10-15?utm_source=global-search&utm_medium=global-search&utm_campaign=global-search,Delhi Pollution GRAP-I restrictions and ban: All you need to know,"UPDATED: Oct 15, 2024 12:51 IST",Listen to Story
359,INDIA TODAY,https://www.indiatoday.in/diu/story/delhi-ncr-air-quality-bad-stubble-burning-aqi-2616813-2024-10-14?utm_source=global-search&utm_medium=global-search&utm_campaign=global-search,Delhi's air quality takes a turn for the worse. Again,"UPDATED: Oct 14, 2024 20:18 IST",Listen to Story
360,INDIA TODAY,https://www.indiatoday.in/cities/delhi/story/delhi-pollution-weather-conditions-stubble-burning-in-pakistan-punjab-haryana-2616571-2024-10-14?utm_source=global-search&utm_medium=global-search&utm_campaign=global-search,How weather conditions are keeping Delhi pollution under check this year,"UPDATED: Oct 14, 2024 15:12 IST",Listen to Story
361,INDIA TODAY,https://www.indiatoday.in/cities/delhi/story/firecrackers-ban-delhi-government-imposes-complete-ban-on-firecrackers-till-january-2025-2616515-2024-10-14?utm_source=global-search&utm_medium=global-search&utm_campaign=global-search,Delhi bans firecrackers till January 1 to fight air pollution,"UPDATED: Oct 14, 2024 15:02 IST",Listen to Story
362,INDIA TODAY,https://www.indiatoday.in/india/delhi/story/commission-for-air-quality-management-ncr-government-officials-prosecuted-failing-curb-paddy-stubble-burning-2615905-2024-10-12?utm_source=global-search&utm_medium=global-search&utm_campaign=global-search,Government officials to be prosecuted on failing to curb stubble burning,"UPDATED: Oct 12, 2024 19:13 IST",Listen to Story
363,INDIA TODAY,https://www.indiatoday.in/environment/story/garbage-management-pollutants-reduction-registers-dip-pollution-26-percent-iit-delhi-2610914-2024-10-04?utm_source=global-search&utm_medium=global-search&utm_campaign=global-search,Garbage management reduces pollution by 26% in key areas: IIT Delhi Study,"UPDATED: Oct 4, 2024 02:45 IST",Listen to Story
364,INDIA TODAY,https://www.indiatoday.in/india/story/delhis-air-quality-aqi-anand-vihar-very-poor-monsoon-retreats-2610911-2024-10-04?utm_source=global-search&utm_medium=global-search&utm_campaign=global-search,Delhi's Anand Vihar records 'very poor' air quality as monsoon retreats,"UPDATED: Oct 4, 2024 02:37 IST",Listen to Story
365,INDIA TODAY,https://www.indiatoday.in/india/law-news/story/delhi-air-pollution-supreme-court-pulls-up-centre-punjab-haryana-stubble-burning-caqm-meetings-fines-2610462-2024-10-03?utm_source=global-search&utm_medium=global-search&utm_campaign=global-search,"Nothing happening but meetings: Top court raps Punjab, Haryana over air pollution","UPDATED: Oct 3, 2024 14:28 IST",Listen to Story
366,INDIA TODAY,https://www.indiatoday.in/india-today-insight/story/iit-delhi-study-red-flags-overlooked-sources-that-pollute-city-air-by-25-40-2610490-2024-10-03?utm_source=global-search&utm_medium=global-search&utm_campaign=global-search,IIT Delhi study red-flags overlooked sources that pollute city air by 25-40%,"UPDATED: Oct 3, 2024 13:59 IST",Listen to Story
367,INDIA TODAY,https://www.indiatoday.in/world/story/brazilians-choke-as-amazon-rainforest-faces-worst-fire-in-14-years-2609096-2024-10-01?utm_source=global-search&utm_medium=global-search&utm_campaign=global-search,Brazilians choke as Amazon rainforest faces worst fire in 14 years,"UPDATED: Oct 1, 2024 09:07 IST",Listen to Story
368,INDIA TODAY,https://www.indiatoday.in/india/law-news/story/supreme-court-slams-commission-for-air-quality-monitoring-stubble-burning-delhi-pollution-2607626-2024-09-27?utm_source=global-search&utm_medium=global-search&utm_campaign=global-search,Air quality panel must take action: What Supreme Court said on stubble burning,"UPDATED: Sep 27, 2024 22:41 IST",Listen to Story
369,INDIA TODAY,https://www.indiatoday.in/india/law-news/story/supreme-court-raps-delhi-air-quality-panel-air-pollution-stubble-burning-2607351-2024-09-27?utm_source=global-search&utm_medium=global-search&utm_campaign=global-search,Silent spectators: Supreme Court blasts air quality panel over Delhi pollution,"UPDATED: Sep 27, 2024 16:12 IST",Listen to Story
370,INDIA TODAY,https://www.indiatoday.in/india-today-insight/story/atishi-govt-vows-winter-of-no-discontent-on-delhis-pollution-key-strategies-2606891-2024-09-26?utm_source=global-search&utm_medium=global-search&utm_campaign=global-search,Atishi govt vows winter of no discontent on Delhi's pollution: Key strategies,"UPDATED: Sep 26, 2024 17:03 IST",Listen to Story
371,INDIA TODAY,https://www.indiatoday.in/cities/delhi/story/delhi-may-get-artificial-rain-in-november-pollution-expected-to-peak-minister-2606168-2024-09-25?utm_source=global-search&utm_medium=global-search&utm_campaign=global-search,"Delhi prepares for artificial rain in November, pollution expected to peak: Minister","UPDATED: Sep 25, 2024 14:06 IST",Listen to Story
372,INDIA TODAY,https://www.indiatoday.in/cities/delhi/story/delhi-air-pollution-lg-vk-saxena-orders-installation-of-anti-smoke-guns-to-tackle-air-pollution-2603578-2024-09-20?utm_source=global-search&utm_medium=global-search&utm_campaign=global-search,Delhi Lt. Governor orders installation of anti-smoke guns to tackle air pollution,"UPDATED: Sep 20, 2024 22:35 IST",Listen to Story
373,INDIA TODAY,https://www.indiatoday.in/health/story/over-7-million-stroke-deaths-every-year-linked-to-air-pollution-high-blood-pressure-lancet-study-2602545-2024-09-19?utm_source=global-search&utm_medium=global-search&utm_campaign=global-search,"Over 7 million stroke deaths every year linked to air pollution, high blood pressure","UPDATED: Sep 19, 2024 11:35 IST",Listen to Story
374,INDIA TODAY,https://www.indiatoday.in/cities/delhi/story/delhi-pollution-response-action-plan-revised-grap-winter-season-air-quality-index-2602404-2024-09-19?utm_source=global-search&utm_medium=global-search&utm_campaign=global-search,Pollution response action plan revised for Delhi ahead of winter season,"UPDATED: Sep 19, 2024 05:23 IST",Listen to Story
375,INDIA TODAY,https://www.indiatoday.in/information/story/india-is-now-worlds-leading-plastic-polluter-study-reveals-2601110-2024-09-17?utm_source=global-search&utm_medium=global-search&utm_campaign=global-search,"India is now world's leading plastic polluter, study reveals","UPDATED: Sep 17, 2024 12:05 IST",Listen to Story
376,INDIA TODAY,https://www.indiatoday.in/information/story/is-earth-in-trouble-study-shows-ozone-layer-loss-puts-us-all-at-risk-2600478-2024-09-16?utm_source=global-search&utm_medium=global-search&utm_campaign=global-search,Is Earth in trouble? Study shows Ozone layer loss puts us all at risk,"UPDATED: Sep 16, 2024 13:06 IST",Listen to Story
377,INDIA TODAY,https://www.indiatoday.in/cities/delhi/story/delhi-chief-minister-arvind-kejriwal-firecracker-ban-tihar-jail-police-case-registered-fir-2599845-2024-09-14?utm_source=global-search&utm_medium=global-search&utm_campaign=global-search,Delhi Police files case over firecrackers burst outside Arvind Kejriwal's home,"UPDATED: Sep 14, 2024 17:01 IST",Listen to Story
378,INDIA TODAY,https://www.indiatoday.in/diu/story/cant-control-what-you-cant-measure-why-india-losing-to-air-pollution-2598796-2024-09-12?utm_source=global-search&utm_medium=global-search&utm_campaign=global-search,Can't control what you can't measure: Why India is losing to air pollution,"UPDATED: Sep 13, 2024 15:19 IST",Listen to Story
379,INDIA TODAY,https://www.indiatoday.in/india-today-insight/story/delhis-air-pollution-from-transport-will-drop-by-half-in-two-years-nitin-gadkari-2597160-2024-09-10?utm_source=global-search&utm_medium=global-search&utm_campaign=global-search,Delhi's air pollution from transport will drop by half in two years: Nitin Gadkari,"UPDATED: Sep 10, 2024 17:00 IST",Listen to Story
380,INDIA TODAY,https://www.indiatoday.in/diu/story/toxic-air-cuts-global-lifespan-2-years-dangerous-than-smoking-report-2590399-2024-08-29?utm_source=global-search&utm_medium=global-search&utm_campaign=global-search,"Toxic air cuts global lifespan by 2 years, more harmful than smoking: Report","UPDATED: Aug 29, 2024 23:38 IST",Listen to Story
381,INDIA TODAY,https://www.indiatoday.in/cities/delhi/story/delhi-government-prepares-action-plan-to-curb-air-pollution-in-winters-2590294-2024-08-29?utm_source=global-search&utm_medium=global-search&utm_campaign=global-search,"Odd-even formula, work from home: Delhi government's plan to curb winter pollution","UPDATED: Aug 29, 2024 21:51 IST",Listen to Story
382,INDIA TODAY,https://www.indiatoday.in/india/delhi/story/delhi-life-expectancy-reduction-12-years-due-air-pollution-air-quality-life-index-report-2589631-2024-08-28?utm_source=global-search&utm_medium=global-search&utm_campaign=global-search,Air pollution may reduce Delhi residents' life expectancy by 12 years: Report,"UPDATED: Aug 28, 2024 20:55 IST",Listen to Story
383,INDIA TODAY,https://www.indiatoday.in/india/story/india-reduces-air-pollution-from-2021-to-2022-air-quality-2589251-2024-08-28?utm_source=global-search&utm_medium=global-search&utm_campaign=global-search,India reduces air pollution by 20% from 2021 to 2022: Study,"UPDATED: Aug 28, 2024 15:36 IST",Listen to Story
384,INDIA TODAY,https://www.indiatoday.in/cities/delhi/story/delhi-minister-gopal-rai-air-pollution-quality-monitoring-system-winter-2589149-2024-08-28?utm_source=global-search&utm_medium=global-search&utm_campaign=global-search,Ensure system to monitor air quality is operational before winter: Delhi minister,"UPDATED: Aug 28, 2024 10:09 IST",Listen to Story
