serial_number,website_name,url,title,date,content
632,INDIA TODAY,https://www.indiatoday.in/cities/noida/story/greater-noida-air-quality-drops-to-hazardous-level-bjp-mla-urges-residents-to-stay-indoors-2457867-2023-11-04?utm_source=global-search&utm_medium=global-search&utm_campaign=global-search,"Greater Noida's air quality is 'hazardous', residents urged to stay indoors","UPDATED: Nov 4, 2023 02:28 IST",Listen to Story
633,INDIA TODAY,https://www.indiatoday.in/cities/delhi/story/no-respite-from-bad-air-for-delhi-for-another-week-met-office-2457861-2023-11-03?utm_source=global-search&utm_medium=global-search&utm_campaign=global-search,No respite from bad air for Delhi for another week: Sources,"UPDATED: Nov 3, 2023 23:28 IST",Listen to Story
634,INDIA TODAY,https://www.indiatoday.in/programme/newstrack-with-rahul-kanwal/video/smog-envelopes-national-capital-who-will-give-delhi-the-right-to-breathe-2457836-2023-11-03?utm_source=global-search&utm_medium=global-search&utm_campaign=global-search,Smog envelopes national capital: Who will give Delhi the right to breathe?,,
635,INDIA TODAY,https://www.indiatoday.in/cities/story/delhi-air-pollution-lg-vk-saxena-meet-arvind-kejriwal-2457682-2023-11-03?utm_source=global-search&utm_medium=global-search&utm_campaign=global-search,"What Delhi Lt Governor, AAP government decided during air pollution meet","UPDATED: Nov 3, 2023 21:07 IST",Listen to Story
636,INDIA TODAY,https://www.indiatoday.in/visualstories/wellness/what-is-trending-74064-03-11-2023?utm_source=global-search&utm_medium=global-search&utm_campaign=global-search,Air pollution: 5 healthy drinks for lungs,,
637,INDIA TODAY,https://www.indiatoday.in/education-today/news/story/delhi-air-pollution-school-holidays-decision-after-aqi-monitoring-over-weekend-2457727-2023-11-03?utm_source=global-search&utm_medium=global-search&utm_campaign=global-search,Delhi air pollution: School holidays decision after AQI monitoring over weekend,"UPDATED: Nov 3, 2023 17:37 IST",Listen to Story
638,INDIA TODAY,https://www.indiatoday.in/cities/delhi/story/delhi-air-pollution-air-quality-levels-severe-smog-tower-non-operational-locked-gates-2457594-2023-11-03?utm_source=global-search&utm_medium=global-search&utm_campaign=global-search,Rs 23-crore smog tower in Delhi stays locked as capital struggles to breathe,"UPDATED: Nov 3, 2023 17:07 IST",Listen to Story
639,INDIA TODAY,https://www.indiatoday.in/health/story/delhi-air-pollution-how-to-protect-your-eyes-from-heavy-smog-2457649-2023-11-03?utm_source=global-search&utm_medium=global-search&utm_campaign=global-search,Delhi air pollution: How to protect your eyes from heavy smog,"UPDATED: Nov 3, 2023 17:06 IST",Listen to Story
640,INDIA TODAY,https://www.indiatoday.in/law/story/you-want-people-to-live-in-gas-chambers-delhi-high-court-raps-forest-panel-delhi-air-pollution-2457669-2023-11-03?utm_source=global-search&utm_medium=global-search&utm_campaign=global-search,'You want people to live in gas chambers?' Delhi High Court raps forest panel,"UPDATED: Nov 3, 2023 16:58 IST",Listen to Story
641,INDIA TODAY,https://www.indiatoday.in/trending-news/story/delhi-air-pollution-sparks-meme-fest-online-see-here-2457690-2023-11-03?utm_source=global-search&utm_medium=global-search&utm_campaign=global-search,Delhi air pollution sparks meme fest online. See here,"UPDATED: Nov 3, 2023 16:49 IST",Listen to Story
642,INDIA TODAY,https://www.indiatoday.in/health/story/delhi-air-pollution-mask-up-say-doctors-amid-fear-of-rising-lung-diseases-2457622-2023-11-03?utm_source=global-search&utm_medium=global-search&utm_campaign=global-search,"Delhi Air Pollution: Mask up, say doctors amid fear of rising lung diseases","UPDATED: Nov 3, 2023 16:36 IST",Listen to Story
643,INDIA TODAY,https://www.indiatoday.in/cities/delhi/story/delhi-congress-leaders-wear-oxygen-masks-to-press-meet-blame-aap-bjp-for-poor-air-2457647-2023-11-03?utm_source=global-search&utm_medium=global-search&utm_campaign=global-search,"Delhi Congress leaders wear oxygen masks, blame AAP, BJP for poor air","UPDATED: Nov 3, 2023 16:32 IST",Listen to Story
644,INDIA TODAY,https://www.indiatoday.in/cities/delhi/story/in-pics-delhi-dire-air-quality-as-thick-brown-haze-hangs-over-city-2457631-2023-11-03?utm_source=global-search&utm_medium=global-search&utm_campaign=global-search,In 5 pics: Delhi's dire air quality as thick brown haze hangs over city,"UPDATED: Nov 3, 2023 15:47 IST",Listen to Story
645,INDIA TODAY,https://www.indiatoday.in/india/story/delhi-air-pollution-severe-aap-gopal-rai-slams-centre-where-is-union-environment-minister-2457463-2023-11-03?utm_source=global-search&utm_medium=global-search&utm_campaign=global-search,'Where is Union Minister?': AAP slams Centre as Delhi breathes toxic air,"UPDATED: Nov 3, 2023 13:56 IST",Listen to Story
646,INDIA TODAY,https://www.indiatoday.in/trending-news/story/delhis-air-quality-index-crosses-700-people-share-posts-of-city-covered-in-smog-2457583-2023-11-03?utm_source=global-search&utm_medium=global-search&utm_campaign=global-search,"Delhi's Air Quality Index crosses 700, people share posts of city covered in smog","UPDATED: Nov 3, 2023 13:52 IST",Listen to Story
647,INDIA TODAY,https://www.indiatoday.in/cities/delhi/story/delhi-ncr-severe-air-quality-delhi-residents-chokes-air-quality-turns-severe-schools-shut-2457459-2023-11-03?utm_source=global-search&utm_medium=global-search&utm_campaign=global-search,"As Delhi's air turns toxic, here's what is being done to tackle pollution","UPDATED: Nov 3, 2023 13:42 IST",Listen to Story
648,INDIA TODAY,https://www.indiatoday.in/india/video/aap-government-slams-centre-as-delhi-breathes-toxic-air-2457567-2023-11-03?utm_source=global-search&utm_medium=global-search&utm_campaign=global-search,AAP government slams Centre as Delhi breathes toxic air,,"As the air quality in Delhi plunged considerably on Friday, Delhi's Environment Minister, Gopal Rai, criticized the Central government and Union Environment Minister Bhupender Yadav for their lack of action regarding the escalating air pollution in Delhi-NCR. Triggering a blame game, Rai said that the majority of pollutants in Delhi's air originate from neighboring states, asking both opposition leaders and the central government to convene emergency meetings to address the issue. He also outlined the measures already implemented by the Delhi government to combat the pollution crisis, including a ban on polluting trucks, commercial four-wheelers, and all construction activities.
Read More"
649,INDIA TODAY,https://www.indiatoday.in/technology/news/story/delhi-air-pollution-as-aqi-crosses-700-here-are-5-gadgets-to-keep-you-safe-2457532-2023-11-03?utm_source=global-search&utm_medium=global-search&utm_campaign=global-search,"Delhi Air Pollution: As AQI crosses 700, here are 5 gadgets to keep you safe","UPDATED: Nov 3, 2023 12:54 IST",Listen to Story
650,INDIA TODAY,https://www.indiatoday.in/cities/delhi/video/video-delhi-signature-bridge-covered-in-blanket-of-smog-as-air-quality-worsens-2457494-2023-11-03?utm_source=global-search&utm_medium=global-search&utm_campaign=global-search,Video: Delhi's Signature Bridge covered in blanket of smog as air quality worsens,,"Delhi’s air quality dipped to the ‘Severe’ category today, according to the Central Pollution Control Board (CPCB). A drone camera footage from Signature Bridge in Delhi showed the city shrouded in a thick blanket of haze. 
Read More"
651,INDIA TODAY,https://www.indiatoday.in/programme/first-up/video/delhi-in-haze-as-aqi-hits-severe-plus-category-government-to-hold-meeting-today-2457466-2023-11-03?utm_source=global-search&utm_medium=global-search&utm_campaign=global-search,"Delhi in haze as AQI hits 'severe plus' category, government to hold meeting today",,"Delhi was blanketed by a thick layer of smog on Friday with the air quality index (AQI) recorded at 471, plummeting to the 'severe plus' category. Authorities are set to hold an emergency meeting today at 12 pm to discuss further measures to be imposed in view of the worsening situation, 
Read More"
652,INDIA TODAY,https://www.indiatoday.in/cities/delhi/story/delhi-ncr-chokes-air-quality-turns-severe-schools-shut-for-2-days-top-points-2457402-2023-11-03?utm_source=global-search&utm_medium=global-search&utm_campaign=global-search,"Delhi's air quality hits 'severe plus' category, schools shut for 2 days: Top points","UPDATED: Nov 3, 2023 10:48 IST",Listen to Story
653,INDIA TODAY,https://www.indiatoday.in/education-today/news/story/all-primary-schools-in-delhi-to-remain-shut-for-2-days-amid-rising-air-pollution-2457450-2023-11-03?utm_source=global-search&utm_medium=global-search&utm_campaign=global-search,All primary schools in Delhi to remain shut for 2 days amid rising air pollution,"UPDATED: Nov 3, 2023 10:19 IST",Listen to Story
654,INDIA TODAY,https://www.indiatoday.in/cities/delhi/story/bs3-petrol-bs4-diesel-cars-banned-in-delhi-fine-rs-20000-air-pollution-hazardous-2457399-2023-11-03?utm_source=global-search&utm_medium=global-search&utm_campaign=global-search,"BS3 petrol, BS4 diesel cars banned in Delhi, can be fined Rs 20,000","UPDATED: Nov 3, 2023 06:38 IST",Listen to Story
655,INDIA TODAY,https://www.indiatoday.in/cities/story/delhi-ncr-pollution-government-private-primary-schools-closed-2-days-2457339-2023-11-02?utm_source=global-search&utm_medium=global-search&utm_campaign=global-search,Primary schools in Delhi shifted online till Saturday as air quality worsens,"UPDATED: Nov 3, 2023 02:38 IST",Listen to Story
656,INDIA TODAY,https://www.indiatoday.in/cities/delhi/story/delhi-metro-to-run-20-extra-train-trips-across-its-network-from-november-3-2457388-2023-11-03?utm_source=global-search&utm_medium=global-search&utm_campaign=global-search,Delhi Metro to run 20 extra train trips across its network from November 3,"UPDATED: Nov 3, 2023 00:06 IST",Listen to Story
657,INDIA TODAY,https://www.indiatoday.in/cities/delhi/story/national-capital-region-covered-in-toxic-smog-with-hazardous-air-quality-level-2457270-2023-11-02?utm_source=global-search&utm_medium=global-search&utm_campaign=global-search,National capital region covered in toxic smog with 'hazardous' air quality level,"UPDATED: Nov 2, 2023 23:51 IST",Listen to Story
658,INDIA TODAY,https://www.indiatoday.in/cities/story/delhi-ncr-pollution-restriction-construction-activities-schools-advised-go-online-grap-3-2457272-2023-11-02?utm_source=global-search&utm_medium=global-search&utm_campaign=global-search,"Delhi restricts construction, schools advised to go online as air quality worsens","UPDATED: Nov 2, 2023 19:33 IST",Listen to Story
659,INDIA TODAY,https://www.indiatoday.in/india/video/video-where-is-delhi-smog-drowns-the-city-and-its-only-november-2457152-2023-11-02?utm_source=global-search&utm_medium=global-search&utm_campaign=global-search,,,
660,INDIA TODAY,https://www.indiatoday.in/india/story/aap-claims-2-mlas-detained-by-police-during-red-light-on-gaadi-off-campaign-2457283-2023-11-02?utm_source=global-search&utm_medium=global-search&utm_campaign=global-search,"AAP claims 2 MLAs detained by police during 'Red Light On, Gaadi Off campaign","UPDATED: Nov 2, 2023 19:08 IST",Listen to Story
661,INDIA TODAY,https://www.indiatoday.in/india/video/water-sprinkled-via-anti-smog-guns-in-delhi-to-combat-air-pollution-2457245-2023-11-02?utm_source=global-search&utm_medium=global-search&utm_campaign=global-search,Water sprinkled via anti-smog guns in Delhi to combat air pollution,,"To mitigate pollution, water was sprinkled through anti-smog guns in Delhi's Anand Vihar area, as the overall Air Quality Index stands at 346 in the 'very poor' category, as per SAFAR-India. 
Read More"
662,INDIA TODAY,https://www.indiatoday.in/health/story/delhi-air-pollution-more-children-likely-to-become-asthmatic-in-long-run-says-aiims-expert-2457220-2023-11-02?utm_source=global-search&utm_medium=global-search&utm_campaign=global-search,"Delhi air pollution: More children likely to become asthmatic in long run, says AIIMS expert","UPDATED: Nov 2, 2023 17:30 IST",Listen to Story
663,INDIA TODAY,https://www.indiatoday.in/india/story/eric-garcetti-statement-on-delhi-pollution-says-daughter-warned-by-teacher-2457060-2023-11-02?utm_source=global-search&utm_medium=global-search&utm_campaign=global-search,'My daughter warned by teacher today...': US envoy as choking haze blankets Delhi,"UPDATED: Nov 2, 2023 14:35 IST",Listen to Story
664,INDIA TODAY,https://www.indiatoday.in/environment/story/climates-catch-22-cutting-pollution-heats-up-the-planet-2457084-2023-11-02?utm_source=global-search&utm_medium=global-search&utm_campaign=global-search,Climate's 'Catch-22': Cutting pollution heats up the planet,"UPDATED: Nov 2, 2023 13:45 IST",Listen to Story
665,INDIA TODAY,https://www.indiatoday.in/health/story/air-pollution-in-delhi-chennai-increasing-risk-of-diabetes-new-study-finds-2457064-2023-11-02?utm_source=global-search&utm_medium=global-search&utm_campaign=global-search,"Air pollution in Delhi, Chennai increasing risk of diabetes, new study finds","UPDATED: Nov 2, 2023 13:41 IST",Listen to Story
666,INDIA TODAY,https://www.indiatoday.in/cities/delhi/story/delhi-air-pollution-delhi-air-quality-hazardous-stubble-burning-low-wind-speed-2456918-2023-11-02?utm_source=global-search&utm_medium=global-search&utm_campaign=global-search,"Delhi's air quality turns 'hazardous', AQI dips to 616 in Mundka area","UPDATED: Nov 2, 2023 07:41 IST",Listen to Story
667,INDIA TODAY,https://www.indiatoday.in/cities/delhi/story/bjp-leaders-distribute-face-masks-delhi-slam-aap-rising-pollution-levels-2456910-2023-11-02?utm_source=global-search&utm_medium=global-search&utm_campaign=global-search,"Delhi BJP leaders distribute face masks, slam AAP over rising pollution levels","UPDATED: Nov 2, 2023 05:57 IST",Listen to Story
668,INDIA TODAY,https://www.indiatoday.in/law/story/why-no-health-advisories-to-citizens-bombay-high-court-on-dangerous-aqi-levels-2456795-2023-11-01?utm_source=global-search&utm_medium=global-search&utm_campaign=global-search,'Why no health advisories to citizens?' Bombay High Court on dangerous AQI levels,"UPDATED: Nov 1, 2023 20:20 IST",Listen to Story
669,INDIA TODAY,https://www.indiatoday.in/india-today-insight/story/why-the-maximum-city-is-seeing-maximum-toxicity-2456812-2023-11-01?utm_source=global-search&utm_medium=global-search&utm_campaign=global-search,Why the 'maximum city' is seeing maximum toxicity,"UPDATED: Nov 1, 2023 20:03 IST",Listen to Story
670,INDIA TODAY,https://www.indiatoday.in/cities/delhi/story/delhi-pollution-delhi-witnesses-seasons-worst-air-quality-as-aqi-crosses-700-mark-2456732-2023-11-01?utm_source=global-search&utm_medium=global-search&utm_campaign=global-search,"Delhi records season's worst air pollution, Anand Vihar tops 'hazardous' level","UPDATED: Nov 1, 2023 19:45 IST",Listen to Story
671,INDIA TODAY,https://www.indiatoday.in/cities/delhi/story/delhi-air-quality-very-poor-aqi-winter-pollution-smog-2456390-2023-11-01?utm_source=global-search&utm_medium=global-search&utm_campaign=global-search,Delhi's air quality 'very poor' for 5th straight day; ban on entry of diesel buses,"UPDATED: Nov 1, 2023 08:31 IST",Listen to Story
672,INDIA TODAY,https://www.indiatoday.in/cities/delhi/story/delhis-air-quality-remains-very-poor-shallow-fog-likely-tomorrow-2456371-2023-10-31?utm_source=global-search&utm_medium=global-search&utm_campaign=global-search,"Delhi's air quality remains 'very poor', shallow fog likely tomorrow","UPDATED: Oct 31, 2023 23:36 IST",Listen to Story
673,INDIA TODAY,https://www.indiatoday.in/law/story/every-day-aqi-is-deteriorating-bombay-high-court-issues-notice-on-rising-pollution-levels-2456170-2023-10-31?utm_source=global-search&utm_medium=global-search&utm_campaign=global-search,'Every day AQI is deteriorating…': Bombay High Court issues notice on rising Air pollution,"UPDATED: Oct 31, 2023 16:59 IST",Listen to Story
674,INDIA TODAY,https://www.indiatoday.in/law/story/supreme-court-punjab-haryana-delhi-uttar-pradesh-rajasthan-rising-air-pollution-air-quality-impact-next-generation-winter-2455986-2023-10-31?utm_source=global-search&utm_medium=global-search&utm_campaign=global-search,'Used to be best time in Delhi': Supreme Court raps 5 states over air pollution,"UPDATED: Oct 31, 2023 14:05 IST",Listen to Story
675,INDIA TODAY,https://www.indiatoday.in/health/story/study-shows-link-between-air-pollution-and-parkinsons-disease-2456061-2023-10-31?utm_source=global-search&utm_medium=global-search&utm_campaign=global-search,Study shows link between air pollution and Parkinson's disease,"UPDATED: Oct 31, 2023 14:05 IST",Listen to Story
676,INDIA TODAY,https://www.indiatoday.in/cities/delhi/story/delhi-pollution-aqi-very-poor-winter-action-plan-2455924-2023-10-31?utm_source=global-search&utm_medium=global-search&utm_campaign=global-search,Delhi's air quality 'very poor' for 4th straight day,"UPDATED: Oct 31, 2023 10:00 IST",Listen to Story
677,INDIA TODAY,https://www.indiatoday.in/newsmo/video/what-delhis-air-pollution-can-do-to-your-lungs-2455809-2023-10-30?utm_source=global-search&utm_medium=global-search&utm_campaign=global-search,What Delhi's air pollution can do to your lungs,,"There is no denying that air pollution is bad for your health, especially your lungs. But just how bad is it and can you do something about it? Watch the video to find out. 
Read More"
678,INDIA TODAY,https://www.indiatoday.in/cities/delhi/story/delhi-air-quality-stays-very-poor-category-for-third-straight-day-no-relief-for-residents-2455461-2023-10-30?utm_source=global-search&utm_medium=global-search&utm_campaign=global-search,"Delhi's air quality stays 'very poor' for 3rd straight day, no respite yet","UPDATED: Oct 30, 2023 15:18 IST",Listen to Story
679,INDIA TODAY,https://www.indiatoday.in/health/health-360/video/air-pollution-in-north-india-delhi-aqi-poor-health-emergency-asthma-breathing-issues-2454858-2023-10-28?utm_source=global-search&utm_medium=global-search&utm_campaign=global-search,Air pollution in North India poses a health emergency,,"As winter approaches, the air quality in the cities of North India has fallen drastically. It is an issue which happens every year. As the AQI dips in Delhi and surrounding cities, doctors say more patients have come in complaining of breathing issues and other health concerns. 
Read More"
680,INDIA TODAY,https://www.indiatoday.in/cities/delhi/story/delhi-air-quality-pollution-remains-poor-category-but-will-worsen-during-the-day-safar-cpcb-2454748-2023-10-28?utm_source=global-search&utm_medium=global-search&utm_campaign=global-search,"Delhi's air quality drops to 'very poor', likely to worsen in upcoming days","UPDATED: Oct 28, 2023 08:57 IST",Listen to Story
681,INDIA TODAY,https://www.indiatoday.in/cities/delhi/story/vehicles-to-be-checked-for-pollution-certificates-delhi-as-air-quality-dips-2454732-2023-10-28?utm_source=global-search&utm_medium=global-search&utm_campaign=global-search,Vehicles to be checked for pollution certificates in Delhi as air quality dips,"UPDATED: Oct 28, 2023 02:00 IST",Listen to Story
682,INDIA TODAY,https://www.indiatoday.in/magazine/up-front/story/20231106-mumbai-maximum-toxi-city-2454620-2023-10-27?utm_source=global-search&utm_medium=global-search&utm_campaign=global-search,Mumbai | Maximum Toxi-City,"ISSUE DATE: Nov 6, 2023","There was a time when Mumbai’s iconic seaside promenade, Marine Drive, would offer visitors such a crisp and exquisite view of the city’s skyline that on a clear day, one could almost count the skyscrapers lining the horizon. But drive down the seafront these days, and it’s not unusual to be greeted by a view that looks as if it’s struggling to peek through the thick brown haze and smog shrouding it. It’s almost gasping for air. Much like Mumbaikars today, who, thanks to the city’s ceaseless construction activity and rising levels of pollutants, coupled with a change in wind patterns, have been forced to choke on air that’s almost as toxic as smoking five to six cigarettes a day. In February this year in fact, according to the Swiss firm IQAir, Mumbai was ranked as the second most polluted city in the world."
683,INDIA TODAY,https://www.indiatoday.in/india/video/aap-government-in-delhi-changes-stance-on-data-for-pollution-in-the-city-2454475-2023-10-27?utm_source=global-search&utm_medium=global-search&utm_campaign=global-search,AAP government in Delhi changes stance on data for pollution in the city,,"Delhi is again in the grips of severe air pollution. Year after year, it strikes with unmissable regularity. Earlier, AAP had blamed stubble burning in Punjab and Haryana for the air pollution in Delhi. 
Read More"
684,INDIA TODAY,https://www.indiatoday.in/cities/delhi/video/delhi-air-quality-dips-very-poor-experts-say-situation-likely-to-worsen-2454463-2023-10-27?utm_source=global-search&utm_medium=global-search&utm_campaign=global-search,"Delhi's air quality dips to 'very poor', experts say situation likely to worsen",,"Delhi's air quality once again dropped to the ""very poor"" category on Friday as the national capital recorded an air quality index (AQI) of 309, as per SAFAR's data at the time of writing this report. Despite the city waking up to a ""poor"" category air quality with an AQI of 249, it declined to 309 soon after. 
Read More"
685,INDIA TODAY,https://www.indiatoday.in/india/story/delhi-air-quality-drops-very-poor-category-pollution-measures-2454288-2023-10-27?utm_source=global-search&utm_medium=global-search&utm_campaign=global-search,Delhi's air quality dips to 'very poor' as pollution curbs come into effect,"UPDATED: Oct 27, 2023 11:23 IST",Listen to Story
686,INDIA TODAY,https://www.indiatoday.in/cities/delhi/story/parking-fee-hike-pollution-plan-delhi-air-quality-2454220-2023-10-27?utm_source=global-search&utm_medium=global-search&utm_campaign=global-search,"Parking fee hike, part of Delhi's anti-pollution plan, not enforced yet: Sources","UPDATED: Oct 27, 2023 06:02 IST",Listen to Story
687,INDIA TODAY,https://www.indiatoday.in/cities/delhi/story/delhi-air-quality-delhi-ncr-aqi-pollution-dussehra-2453751-2023-10-26?utm_source=global-search&utm_medium=global-search&utm_campaign=global-search,"Delhi's air 'poor' again; 'red light on, gaadi off' campaign launched","UPDATED: Oct 27, 2023 02:01 IST",Listen to Story
688,INDIA TODAY,https://www.indiatoday.in/cities/delhi/story/november-cng-electric-diesel-buses-allowed-delhi-ncr-pollution-2454215-2023-10-27?utm_source=global-search&utm_medium=global-search&utm_campaign=global-search,"From November 1, only CNG, electric buses allowed in Delhi-NCR region","UPDATED: Oct 27, 2023 01:39 IST",Listen to Story
689,INDIA TODAY,https://www.indiatoday.in/programme/to-the-point/video/delhis-air-quality-plunges-to-poor-8-years-and-no-solutions-2454142-2023-10-26?utm_source=global-search&utm_medium=global-search&utm_campaign=global-search,Delhi's air quality plunges to poor: 8 years and no solutions?,,"Delhi is battling air pollution again, like it has been doing every year around the same time. As stubble burning goes up in Punjab and Haryana, air quality in the national capital is worsening. Delhi's air quality was recorded in the 'poor' category for the fourth consecutive day on Thursday and any improvement is unlikely soon, according to monitoring agencies.


Read More"
690,INDIA TODAY,https://www.indiatoday.in/technology/features/story/looking-to-buy-air-purifiers-make-sure-these-features-are-included-2454018-2023-10-26?utm_source=global-search&utm_medium=global-search&utm_campaign=global-search,Looking to buy air purifiers? Make sure these features are included,"UPDATED: Oct 26, 2023 17:11 IST",Listen to Story
691,INDIA TODAY,https://www.indiatoday.in/india/story/aap-atishi-delhi-pollution-source-stubble-burning-punjab-haryana-no-data-2453884-2023-10-26?utm_source=global-search&utm_medium=global-search&utm_campaign=global-search,'No data on Delhi pollution source': AAP minister Atishi changes stance,"UPDATED: Oct 26, 2023 14:00 IST",Listen to Story
692,INDIA TODAY,https://www.indiatoday.in/india/video/visuals-show-delhis-alarming-aqi-city-preps-for-smoky-november-2453912-2023-10-26?utm_source=global-search&utm_medium=global-search&utm_campaign=global-search,"Visuals show Delhi's alarming AQI, city preps for smoky November",,"Delhi's Air Quality Index (AQI) dipped into the 'unhealthy' category, with a US AQI rating of 256 on October 26. This is 21 times the WHO annual air quality guideline. 
Read More"
693,INDIA TODAY,https://www.indiatoday.in/cities/delhi/story/delhis-air-quality-hits-3-year-low-on-dussehra-late-festival-date-key-reason-2453723-2023-10-26?utm_source=global-search&utm_medium=global-search&utm_campaign=global-search,"Delhi's air quality hits 3-year low on Dussehra, late festival date key reason","UPDATED: Oct 26, 2023 06:15 IST",Listen to Story
694,INDIA TODAY,https://www.indiatoday.in/india/story/stubble-burning-down-by-50-per-cent-from-2022-may-peak-during-diwali-in-punjab-2453699-2023-10-25?utm_source=global-search&utm_medium=global-search&utm_campaign=global-search,"Stubble burning down by 50% from 2022, may peak during Diwali in Punjab","UPDATED: Oct 25, 2023 23:48 IST",Listen to Story
695,INDIA TODAY,https://www.indiatoday.in/cities/mumbai/story/bmc-mumbai-air-pollution-aqi-guidelines-2453651-2023-10-25?utm_source=global-search&utm_medium=global-search&utm_campaign=global-search,Mumbai civic panel issues fresh guidelines to combat air pollution woes,"UPDATED: Oct 25, 2023 23:16 IST",Listen to Story
696,INDIA TODAY,https://www.indiatoday.in/cities/delhi/story/delhi-air-pollution-aqi-red-light-on-gaadi-off-arvind-kejriwal-aap-curb-pollution-2453671-2023-10-25?utm_source=global-search&utm_medium=global-search&utm_campaign=global-search,"Red light on, gaadi off: Delhi to start anti-pollution campaign from tomorrow","UPDATED: Oct 25, 2023 23:15 IST",Listen to Story
