serial_number,website_name,url,title,date,content
26,Times of India,https://timesofindia.indiatimes.com/city/hyderabad/hyderabad-chokes-air-pollution-hits-new-high-as-cold-weather-takes-hold/articleshow/117157120.cms,Hyderabad chokes: Air pollution hits new high as cold weather takes hold,,"Hyderabad: The city is reeling under a severe air pollution crisis as temperatures in parts of the city plummet to as low as 8° Celsius. The Air Quality Index (AQI) has soared past 150 across multiple localities, marking the season's worst pollution levels. Concentrations of harmful pollutants, including PM 2.5, PM 10, and NO2, have spiked alarmingly, with some areas reporting levels up to 100 times higher than the World Health Organisation's (WHO) recommended limits.
Localities such as Sanath Nagar, Somajiguda, Gachibowli, Kokapet, Punjagutta, and Old City are among the worst affected. Sanath Nagar recorded PM 2.5 levels of 500 µg/m³, a 100 times higher than the WHO guideline of 5 µg/m³. Similarly, Somajiguda reported 280 µg/m³, while Kokapet, Kompally, and Ramachandrapuram exceeded 200 µg/m³. PM 10 levels were equally alarming, with ECIL registering 204 µg/m³, followed by Gachibowli (160 µg/m³) and Old City (158 µg/m³).
The deteriorating air quality has triggered a spike in respiratory illnesses, with cases of asthma, chronic coughs, and lung infections surging across the city.
Highlighted the dire health implications, Dr Tejas Jogi, a pulmonologist said, ""Pollution levels are rising year-round, but winter magnifies the impact. Temperature inversion traps pollutants close to the ground, worsening conditions. PM 2.5 particles penetrate deep into the lungs, weakening immunity and increasing risks of respiratory infections like pneumonia and bronchitis.""
  BY TABOOLA
SPONSORED LINKS
YOU MAY LIKE
She's is Revealing Her Secret Strategy in Commodity Trading
TradeWise
Learn More
Between 2008 and 2020, Hyderabad recorded an annual average of 5,552 deaths linked to air pollution, with 1,597 fatalities reported in 2023 alone, making it the sixth deadliest city in India for pollution-related deaths. Vulnerable groups, especially children with developing lungs, are at heightened risk.
Environmental experts point to temperature inversion as a key factor exacerbating winter air pollution. Padmaja K, a pollution researcher in Hyderabad, said, ""During the night, the ground cools rapidly, trapping cooler air beneath a warmer layer and preventing pollutants from dispersing. Weak winter winds further slow the process, allowing pollutants to accumulate.""
Experts underscore the urgent need for strengthening public transport, promoting cycling and walking, phasing out old vehicles, and cracking down on adulterated fuels are seen as critical steps. Improved traffic management, stricter monitoring of industrial emissions, and regulation of construction activities are also essential, experts pointed out.
""Simple measures, like installing curtains around construction sites and sprinkling water to reduce dust, can make a big difference,"" said environmentalist Bhaskar Reddy. He added, ""We can't eliminate pollution entirely, but controlling it is within our reach. Enforcing existing laws and penalising violators are crucial to curb pollution and slow climate change."""
27,Times of India,https://timesofindia.indiatimes.com/life-style/health-fitness/health-news/short-and-long-term-effects-of-air-pollution-on-vision-what-you-need-to-know/articleshow/116332286.cms,Short and long-term effects of air pollution on vision: What you need to know,,"Air pollution is one of the most pressing environmental and health crises in modern India. While its impacts on respiratory and cardiovascular health are well-documented, its effects on vision and eye health are often overlooked. With cities like Delhi facing hazardous air quality levels year-round, it is essential to understand how polluted air affects the eyes in both the short and long term.
Immediate effects of air pollution on vision
Air pollution can cause a range of immediate discomforts and symptoms in the eyes. Redness, irritation, and a burning sensation are among the most common complaints. These issues arise because pollutants such as particulate matter (PM2.5 and PM10) and toxic gases like sulfur dioxide and nitrogen dioxide come into direct contact with the eye's surface.
Dry eye syndrome, a condition where the eyes fail to produce sufficient tears or the tears evaporate too quickly, is also closely linked to air pollution. Pollutants disrupt the tear film, the natural protective layer of the eye, leaving the eyes feeling gritty, itchy, and prone to infections. Additionally, many individuals experience allergic reactions, such as conjunctivitis, which causes swelling, itching, and watery discharge.
  BY TABOOLA
SPONSORED LINKS
YOU MAY LIKE
Get a ₹2CR LifeCover at ₹889/month today with Axis Max Life.
Axis Max Life Insurance
Get Quote
Long-term impact on eye health
While immediate discomfort is alarming, the long-term consequences of air pollution on vision are even more concerning. Chronic exposure to polluted air has been associated with several serious eye conditions:
1. Age-Related Macular Degeneration (AMD)
AMD is a leading cause of vision loss among individuals over the age of 50. Research shows that fine particulate matter, particularly PM2.5, can accelerate the onset of AMD by causing oxidative stress and inflammation in the retina. People living in urban areas with poor air quality are at a significantly higher risk.

2. Cataracts
Cataracts, a condition where the natural lens of the eye becomes cloudy, impairing vision, have also been linked to air pollution. Prolonged exposure to ultraviolet (UV) radiation, combined with pollutants, accelerates the development of cataracts. This issue is especially prevalent in countries like India, where outdoor workers are disproportionately exposed to both pollution and sunlight.
3. Glaucoma
Emerging research suggests that pollution may contribute to glaucoma, a group of conditions that damage the optic nerve and can lead to permanent blindness. High levels of air pollution are believed to elevate intraocular pressure, one of the main risk factors for glaucoma, further underscoring the need for vigilance.
Delhi’s air pollution crisis
Delhi, infamous for its hazardous air quality, provides a case study on how pollution impacts vision. In November 2024, the city’s Air Quality Index (AQI) hit 484—classified as ""severe plus."" During such episodes, hospitals and clinics report a sharp rise in cases of eye irritation, dry eye syndrome, and allergic conjunctivitis. The dense smog not only obscures visibility but also worsens eye conditions, particularly for individuals with pre-existing sensitivities.
How to protect your eyes from air pollution
Protecting your eyes amidst rising pollution levels requires adopting preventive measures:
1. Wear protective eyewear: Sunglasses or goggles act as a barrier against pollutants and UV radiation.
2. Practice eye hygiene: Regularly rinsing your eyes with clean water helps remove irritants and reduce discomfort.
3. Use artificial tears: Over-the-counter lubricating eye drops can help maintain moisture in your eyes and prevent dryness.
4. Limit outdoor activities: Avoid venturing outdoors during peak pollution hours, typically early morning and late evening.
5. Maintain indoor air quality: Using air purifiers at home can reduce exposure to indoor air pollutants.
Government and community efforts to mitigate pollution
Authorities have taken steps to combat the alarming levels of pollution. Measures like halting construction activities, restricting the use of older diesel vehicles, and closing schools during severe pollution days aim to reduce exposure. However, long-term solutions require a collective effort. Public awareness campaigns, stricter emission controls, and green urban initiatives, such as tree planting, are essential.
Why vision protection matters
The eyes are among the most sensitive organs in the body, and their health can deteriorate rapidly under adverse conditions. Protecting your vision is not just about addressing immediate discomfort but also about preventing long-term damage. With pollution levels showing no signs of abating, individual efforts to protect eye health must go hand in hand with systemic reforms to improve air quality.
Air pollution’s effects on vision are both immediate and long-lasting. From minor irritation to irreversible conditions like AMD and glaucoma, the risks are significant. While individual precautions can alleviate short-term symptoms, a sustainable solution to the pollution crisis is essential to safeguard public health. As the nation continues to urbanize, addressing air pollution must remain a top priority to ensure a healthier future for generations to come.
Dr. Garvita Singh, Senior Consultant, Sharp Sight Eye Hospitals"
28,Times of India,https://timesofindia.indiatimes.com/city/noida/noidas-air-quality-improves-but-remains-in-poor-category/articleshow/117130308.cms,"Noida’s air quality improves, but remains in ‘poor’ category",,"1
2
Noida: City's average air quality index showed a marginal improvement at 240 on Friday, from 259 recorded a day ago, but remained in the ‘poor' category. While a thick fog shrouded the city in the morning, in some pockets, the AQI improved to ‘moderate' level as the day progressed.
CPCB's data for air quality monitoring stations showed that at 4pm, the AQI at Sector 125 station was 195, which is in the moderate category. During the same period, the average AQI at Sector 1 station was 282 and Sector 116 was 224, both in the poor category. The readings of Sector 62 station were not available.
In Greater Noida, the average AQI was recorded at 214, down from Thursday's 270. Knowledge Park V, which covers Greater Noida West, recorded 242 in the poor category, and Knowledge Park III recorded 175 in the moderate category.
Ghaziabad too saw a marginal improvement with an AQI of 293 (poor), from 332 (very poor) recorded the previous day. , Indirapuram recorded 327 and Vasundhara recorded 305—both in the very poor category—while Loni recorded 258 and Sanjay Nagar recorded 222—both in the moderate category.
  BY TABOOLA
SPONSORED LINKS
YOU MAY LIKE
Get a ₹2CR LifeCover at ₹889/month today with Axis Max Life.
Axis Max Life Insurance
Get Quote
Delhi's AQI deteriorated to 397 on the day, from Thursday's 357, both ‘very poor'.
A bulletin issued by Indian Institute of Tropical Meteorology (IITM) on Friday stated wind was blowing from the southeast with a speed of less than 6 kmph until evening. It dropped below 4km during the night.
The IITM forecast said wind speed will gradually increase towards the afternoon, clocking up to 8-10 kmph, on Saturday. AQI will remain in the poor category. MSID:: 117126754 413 |"
29,Times of India,https://timesofindia.indiatimes.com/life-style/health-fitness/health-news/living-close-to-an-airport-study-says-you-can-have-these-adverse-health-effects/articleshow/117128206.cms,Living close to an airport? Study says you can have these adverse health effects,,".
Living close to an airport could actually land you in the hospital. A new UK study highlights that, there are significant health risks of constant exposure to airplane noise.
The findings of the study brings about bad news for the 40 million Americans who reside near major airports.
  BY TABOOLA
SPONSORED LINKS
YOU MAY LIKE
""2 Most Profitable Trading Strategy in 2024"" by Hiral
TradeWise
Learn More
What does the study say?

Researchers from University College London (UCL) analyzed health records of 3,600 airport neighbors and 21,300 people who don’t live near a flight path to examine the effects of substantial and moderate aircraft commotion compared to no noise.
The residents exposed to worse racket, especially at night, had stiffer and thicker heart muscles that doubled or quadrupled their risk of a heart attack, life-threatening heart rhythm or stroke, the researchers said.
Senior study author and cardiologist Dr. Gaby Captur, said, “Our study is observational so we cannot say with certainty that high levels of aircraft noise caused these differences in heart structure and function.”
He added, “However, our findings add to a growing body of evidence that aircraft noise can adversely affect heart health and our health more generally.”
Higher noise was defined as exceeding an average of 50 decibels during the day and 45 decibels between 11 pm and 7 am. Fifty decibels is generally considered to be the equivalent of a humming refrigerator.
The World Health Organization recommends limiting daytime aircraft noise to 45 decibels and nighttime noise to 40 decibels to avoid negative health effects. Compared to road or rail noise, planes tend to be louder and more unpredictable. So, according to the UCL researchers, it’s difficult to get used to them.

Past research has linked constant plane noise to sleep disturbances, increased stress, impaired cognition in children, weight gain and a higher risk of high blood pressure and heart disease. The UCL researchers attributed much of the changes in heart structure and function to obesity and high blood pressure (specifically for those exposed to daytime noise). Among the study participants, 8% lived in an area with high daytime noise and 3% with high nighttime noise. Moving away from the airport helped improve health.
Living near an airport can be hazardous to your health and safety. The risks increase with how close you live to the airport and how often you're exposed to aircraft noise and emissions.
Health risks are:

Air pollution: Aircraft emissions can expose you to high levels of ultrafine particles (UFPs) that can damage your lungs and breathing passages. UFPs can also worsen asthma symptoms and impair cognitive ability in children.
Noise pollution: The constant noise from aircraft taking off and landing can disrupt your sleep and quality of life.
Cardiovascular disease: Exposure to aircraft noise and emissions can increase your risk of heart disease and hypertension.
Respiratory issues: People with pre-existing conditions like asthma may experience more frequent and severe respiratory symptoms.
Mental health problems: The stress and sleep disturbances caused by aircraft noise can contribute to anxiety and depression.
Safety concerns are:
Traffic congestion: Airports can generate significant traffic congestion in the surrounding areas, which can lead to longer commute times.
Aircraft emergencies: In the event of an aircraft emergency, properties near the airport may be at a higher risk.

What’s the safe distance?

A study supported by the Robert Wood Johnson Foundation in collaboration with the University of California and Columbia University found that people who lived within six miles of 12 of California's largest airports exhibited higher levels of asthma and heart-related problems.
The ideal distance to live from an airport depends on your preferences and how much noise and pollution you're willing to tolerate.
Noise pollution
Distance from flight paths: Properties closer to flight paths will experience more noise.
Elevation: Properties at higher elevations may experience less noise.
Orientation: Properties with windows and outdoor spaces facing away from the airport may be quieter.
Air pollution
Ultrafine particles: Airport exhaust contains ultrafine particles that can be inhaled or swallowed and can worsen asthma symptoms.
Air quality: Heavy airplane traffic can pollute the air up to 10 miles away.
Watching 17 minutes of YouTube videos can drive down prejudice: Study"
30,Times of India,https://timesofindia.indiatimes.com/city/gurgaon/gurgaons-aqi-improves-slightly-but-stays-poor/articleshow/117123813.cms,"Gurgaon’s AQI improves slightly, but stays ‘poor’",,"Gurgaon: The city's air quality remained in the ‘poor' category for the third consecutive day on Friday, with a reading of 218. This was a slight improvement from the previous day's air quality index (AQI) of 236.
Of the three monitoring stations, two — Teri Gram and Vikas Sadan — recorded AQI levels in the poor category with readings of 272 and 203, respectively. However, the AQI in Sector 51 was slightly better, classified as ‘moderate', with a reading of 186. The AQI at Gwalpahari could not be recorded due to insufficient data.
Experts predicted that the AQI was likely to remain in the ‘poor' to ‘very poor' category over the next six days, primarily due to the unfavourable dispersion of pollutants.
According to System of Air Quality and Weather Forecasting and Research (Safar), the ventilation index, which measures the atmosphere's ability to disperse pollutants, is lower than the required 6,000m²/s. The average wind speed, which is less than 10kmph, added to poor pollutant dispersion.
  BY TABOOLA
SPONSORED LINKS
YOU MAY LIKE
Get a ₹2CR LifeCover at ₹889/month today with Axis Max Life.
Axis Max Life Insurance
Get Quote
""The predominant surface wind is likely to blow from the southeast direction at a speed of less than 6kmph during morning hours on Saturday. Smog or moderate fog in most places and dense fog in isolated places is likely in the morning. The wind speed will gradually increase thereafter, becoming 8-10kmph from the southeast direction during the afternoon. It will decrease towards the evening and night, becoming less than 4kmph from the southeast direction. The ventilation index is likely to be 4500 m²/s on Saturday,"" Safar stated.
Meanwhile, the particulate matter levels in the city remain highly concerning. Vikas Sadan recorded a PM2.5 level of 407 µg/m³, nearly 27 times higher than the World Health Organization's (WHO) safe limit of 15 µg/m³. It was followed by Teri Gram (374 µg/m³) and Sector 51 at 340 µg/m³.
PM10 levels were also the worst at Sector 51 at 426 µg/m³ — nine times WHO's safe threshold of 45 µg/m³. Vikas Sadan measured 377 µg/m³ and Teri Gram 253 µg/m³. While both the PM2.5 and PM10 data were not available for Gwalpahari.
The Central Pollution Control Board's (CPCB) annual safe limit is 60 µg/m³ for PM2.5 and 100 µg/m³ for PM10."
