serial_number,website_name,url,title,date,content
10,Times of India,https://timesofindia.indiatimes.com/city/mumbai/smoggy-sunday-marathon-air-foul-along-route-survey/articleshow/117340989.cms,Smoggy Sunday marathon? Air foul along route: Survey,,"Mumbai: As the city prepares for the Tata Mumbai Marathon (TMM) 2025, the air that thousands of participants will breathe on Sunday may not be satisfactory. Just 48 hours before the annual mega running event, a survey conducted by an environmental group on Friday morning found pollution levels along the route very high and breaching safety limits.
Thanks to the smoggy conditions prevailing due to the winter chill brought in by northerly winds, the speed of the sea breeze, which otherwise drives away the smog, was reduced.
On Friday, between 5am and 8.27am, volunteers of Awaaz Foundation used a sensor-based monitor to record PM2.5 particulate matter to check pollution levels at eight spots along the marathon route. None of the locations had particulate matter levels within limits considered ‘safe' by the authorities, Awaaz Foundation claimed. The routes of both the full (42.19km) and half (21.09km) marathons cover the stretch between the Chhatrapati Shivaji Maharaj Terminus in south Mumbai and Bandra in the western suburbs.
In a letter to the Maharashtra Pollution Control Board and BMC, Awaaz Foundation's convenor Sumaira Abdulali said the highest pollution level of 154 micrograms per cubic metre was found at Mahim Reti Bunder, not far from the starting point of the half marathon in which 15,000 runners would be participating on Sunday. The lowest level of 95 micrograms per cubic metre was found at Khan Abdul Gaffar Khan Road in central Mumbai, the letter said, adding that as per the Central Pollution Control Board (CPCB) norms, the safe limit for PM2.5 is 60 micrograms for 24 hours.
  BY TABOOLA
SPONSORED LINKS
YOU MAY LIKE
Get a ₹2CR LifeCover at ₹889/month today with Axis Max Life.
Axis Max Life Insurance
Get Quote
""In light of the consistently poor air quality displayed by govt monitors in nearby areas for the past few months, the aim was to ascertain the health impact of air pollution on marathon participants, particularly those with pre-existing health concerns. All readings were well in excess of the CPCB safe limit for PM2.5 of 60 µg/m3 for 24 hours,"" said Abdulali in her letter. ""Given the concerning air pollution levels in Mumbai for the last few weeks and the fact that poor air quality poses a serious health risk, especially for endurance athletes and those involved in such sporting or leisure activities, we request that BMC, MPCB, and other authorities conduct official tests to ascertain the PM2.5 air quality along the length of the marathon route."""
11,Times of India,https://timesofindia.indiatimes.com/india/grap-3-curbs-revoked-in-delhi-ncr-amid-dip-in-pollution/articleshow/117336116.cms,GRAP 3 curbs revoked in Delhi-NCR amid dip in pollution,,"NEW DELHI: The Centre's panel on Delhi-NCR's air quality on Friday revoked curbs under stage 3 of the Graded Response Action Plan (GRAP) amid a dip in pollution due to favourable meteorological conditions, according to an official order. Calm winds, low temperatures and foggy conditions had allowed accumulation of pollutants in the region earlier this week, promoting the Commission for Air Quality Management (CAQM) to implement strictest curbs under stage 3 and 4 of GRAP.
The panel decided to revoke stage 4 curbs on Thursday amid a dip in pollution levels following a spell of rain in the region.
On Friday, air pollution level declined further amid strong winds, leading to revocation of stage 3 curbs.
GRAP Stage 3 entails a ban on non-essential construction work.
  BY TABOOLA
SPONSORED LINKS
YOU MAY LIKE
Get a ₹2CR Life Cover at just ₹889/month today with Axis Max Life
Axis Max Life Insurance
Get Quote
Classes up to grade 5 are required to shift to hybrid mode under Stage 3. Parents and students have the option to choose online education wherever available.
Under Stage 3, the use of BS-III petrol and BS-IV diesel cars (4-wheelers) is restricted in Delhi and nearby NCR districts. Persons with disabilities are exempt. Stage 3 also bans non-essential diesel-operated medium goods vehicles with BS-IV or older standards in Delhi.
During winters, the Delhi-NCR region enforces restrictions under GRAP, which categorizes air quality into four stages - Stage 1 (Poor, AQI 201-300), Stage 2 (Very Poor, AQI 301-400), Stage 3 (Severe, AQI 401-450), and Stage 4 (Severe Plus, AQI above 450).
Unfavourable meteorological conditions, combined with vehicle emissions, paddy-straw burning, firecrackers, and other local pollution sources, lead to hazardous air quality levels in Delhi-NCR during winters."
12,Times of India,https://timesofindia.indiatimes.com/life-style/spotlight/30-years-ago-masks-air-purifiers-were-unheard-of/articleshow/117303043.cms,"'30 years ago, masks & air purifiers were unheard of'",,"PM2.5 concentration is currently 18.2 times the World Health Organisation’s annual PM2.5 guideline value Source: IQAir
In the current day we wake up to our air purifiers, smartphones warning us that the air quality is in the ‘very poor’ or ‘hazardous’ category. Whether schools, offices and going out will be physical or online, it all now depends on the quality of the air on a given day. The Air Quality Index, always fluctuating between 300-600, wasn’t a common phenomenon 30 years back. Even the discussion around air or air quality wasn’t a household thing.
While Delhi’s air quality is the biggest issue we discuss in our day-to-day lives now – online classes, working from home on account of pollution, people gifting air purifiers to each other on Diwali, kids taking inhalers to schools wasn’t something people in the ’90s thought of.
“Children in the late 90s didn’t know the word air pollution. but today as September ends, kids start asking, ‘Isn’t this the time when schools will be closing because of air pollution?’” says Dr Arvind

‘Nebulisers, air purifiers and masks in day-to-day use, were nonexistent 30 years ago’
  BY TABOOLA
SPONSORED LINKS
YOU MAY LIKE
Get a ₹2CR Life Cover at just ₹889/month today with Axis Max Life
Axis Max Life Insurance
Get Quote
Dr Arvind Kumar, Chairman, Lung Transplant, Medanta, Gurugram, moved to Delhi in 1976. The 66-year-old says that until 2004-2006, nobody spoke about air quality. “The term AQI
came into our lives in 2014. Nobody in Delhi was talking about air or air quality 30 years back. It wasn’t the best back then, but it wasn’t the way it is today either. Things like nebulisers, air purifiers and masks in day-to-day use, were nonexistent. When my children were growing up in Delhi in 2000, on the AIIMS campus, we needed nebulisers. That was a subtle change. But masks and air purifiers are all a post 2014-2015 phenomenon. The routine monitoring of air started around 1995. The forecasting and reporting on air quality started around 2014 and now we have real-time information on our air purifiers and AQI,” shares the doctor.
""The biggest change that we have seen in our practice of respiratory medicine is the awareness about lung diseases that pollution can cause, and nowadays we see
many patients walking to us in the OPD and enquiring about their lung health and the adverse effect pollution is causing,” says Dr Puneet Khanna, HOD and Consultant, Pulmonology, HCMCT Manipal Hospitals, Dwarka.
This is what we are breathing currently

‘Anyone who breathes - a newborn or an elderly - smokes 15-20 cigarettes in Oct-Nov in Delhi’
“As per a formula 22 microgram of PM2.5 is equal to 1 cigarette. So, when the PM2.5 level is at 400, mostly in Oct-Nov these days, it is equivalent to smoke of 15-20 cigarettes a day. I say that during Oct-Nov when PM2.5 is at 350-400, it is like smoking that number of cigarettes by anyone who breathes. That includes newborns to elderly. When I operate on teenagers, I see black deposits in their lungs, too, which was unheard of 30 years back,” says Dr Arvind Kumar.
Air quality in ’97
A 1997 white paper published by the Central Pollution Control Board (CPCB) and the Ministry of Environment and Forests (MoEF) listed the annual averages of total
suspended PM (TSP) values as 373, 338, 317, 377, 372, 377, 407, 387, and 370 μg/ m3 for the period of 1989 to 1997 (9 years), based on data collected by manual stations
Source: What Is Polluting Delhi’s Air? A Review from 1990 to 2022
PM2.5 concentration is currently 18.2 times the World Health Organisation’s annual PM2.5 guideline value Source: IQAir
Lifestyle changes that became a default in NCR post AQI
Telling people not to exercise. This advice is particularly hard for doctors to offer as they keep encouraging people to exercise
Stopping children from playing outdoors – something that every child enjoys. It is heartbreaking for paediatricians
Moving from physical to online classes, which takes away an essential component of learning together in person. This often generates a sense of guilt of having failed our children as parents, teachers and paediatricians
Assessing visiting places based on ability to control AQI in the premises
Forcing some people, who just can’t handle the high AQI because of medical conditions, to think about moving away from Delhi in what used to be the best time to enjoy the outdoors – Inputs by Dr Anupam Sibal, Group Medical Director and Senior Consultant Paediatrician, Apollo Hospitals Group
‘The 90s saw a less crowded, greener Delhi, with fewer vehicles, and sparrows in its parks’
The 1990s saw a less crowded, greener Delhi, with fewer vehicles, minimal construction, and an abundance of sparrows in its parks. Still, the city’s skyline was dominated by the smokeemitting chimneys of the Indraprastha and Rajghat power stations, along with a Badarpur Power station on the capital’s outskirts. The air was thick with soot, and vehicles belched black smoke as a common sight. Riding a scooter for a few kilometres left burning red eyes and a black layer of soot on white shirts. 30 years ago, Delhi took its first significant step to combat air pollution by adopting CNG
– Mohan George, Consultant, Clean Air & Sustainable Mobility, Center for Science and Environment (and Ex. Additional Director at Delhi Pollution Control Committee)
Switching to CNG was a significant step in mitigating air pollution in the 90s
Air quality might once have been an unfamiliar term, but the choking haze of pollution was an undeniable reality even in the mid-90s. Anumita Roychowdhury, Executive Director for Research and Advocacy, Centre for Science and Environment, shares, ""When our Right to Clean Air Campaign was initiated in 1996, Delhi’s choking haze of pollution was visibly black. But there was barely any data to piece together the pollution jigsaw and to see through the smokescreen. Authorities could easily dismiss the problem of particulate matter as ‘natural dust’. We used photos of black human lungs as warheads to provoke a response. Despite these odds, we have seen massive energy changeover, with public and commercial transport moving from diesel to CNG and industrial areas switching from coal, pet coke and furnace oil to natural gas in Delhi. These were tough battles."" She adds, ""I still recall the April 5, 2002 directive of the Supreme Court, upholding the Right to Life, that declined to dilute the 1998 CNG order and imposed a penalty for non-compliance. Delhi’s first action phase was driven by desperation and the urgency for immediate relief. Yet despite the initial gains, air quality is far from the clean benchmark.""
""Even after switching to CNG it feels like we keep returning to square one when it comes to pollution. My daughter was born in ’95 and my son was born in ’97. Even in the ’90s, the air was bad enough for the doctor to warn me, during both pregnancies, that my placenta resembled that of a heavy smoker, due to pollution. She advised me to stay indoors,"" adds Swapna Liddle, historian and author."
13,Times of India,https://timesofindia.indiatimes.com/city/chandigarh/cpcc-notice-to-mc-over-waste-burning/articleshow/117310651.cms,CPCC notice to MC over waste burning,,"1
2
Chandigarh: Amid escalating concerns over air pollution, the Chandigarh Pollution Control Committee (CPCC) has issued a formal notice to the MC commissioner due to ongoing instances of waste burning throughout the city, despite previous warnings.
The CPCC has issued strict instructions to the civic body, demanding immediate action to prevent waste burning across Chandigarh and enforce penalties against violators. The notice said, ""Despite notices by CPCC and instructions of the chief secretary during the review meeting of NGT matter 606/2018 that nowhere in Chandigarh should waste be burnt and strict action should be taken against defaulters, waste is still being burnt in various places in Chandigarh, more specifically in Sector 53, where it is regularly noticed that waste is being burnt on an almost daily basis.""
The situation worsened when the MC was found disposing of unprocessed solid waste in vacant areas in Sector 53. Following TOI's coverage and UT chief secretary's intervention, senior MC officials acted to stop the dumping, yet the burning of existing waste continued.
The notice additionally said, ""Waste is being burnt at the backside of the Continuous Ambient Air Quality Monitoring station, Sector 53, in an open field, creating a very bad impact on air quality."" The CPCC had previously advised the MC to address this issue in October 2024.
  BY TABOOLA
SPONSORED LINKS
YOU MAY LIKE
Get a ₹2CR LifeCover at ₹889/month today with Axis Max Life.
Axis Max Life Insurance
Get Quote
The waste burning significantly affects the city's air quality. The CPCC noted that winter conditions have already compromised air quality, necessitating the Graded Action Response Plan. The committee emphasised that waste burning further deteriorates air quality, endangering residents' health.
Should the MC fail to address these violations following the CPCC notice and administration directives, the committee may implement environmental compensation penalties against the corporation."
14,Times of India,https://timesofindia.indiatimes.com/city/gurgaon/aqi-turns-moderate-in-gurgaon-after-morning-rain-grap-iv-revoked/articleshow/117305609.cms,"AQI turns ‘moderate’ in Gurgaon after morning rain, GRAP-IV revoked",,"Gurgaon: Light rain on Thursday morning helped the city breathe easier as the air quality index was 161 (moderate). The drizzle brought much-needed relief from the pollution levels that saw a steep surge on Wednesday when the AQI was recorded at a 'poor' reading of 270, a jump of over 100 points from Tuesday's 156.
The relief, however, is temporary, warned experts. According to forecasts, unfavourable meteorological conditions for the dispersion of pollutants may push the AQI into the 'poor' or 'very poor' category in the coming days.
Stages III and IV of GRAP were invoked on Wednesday after a spike in AQI. GRAP-IV, however, was revoked across NCR on Thursday due to better air conditions. Restrictions under stages I, II, and III, will continue to remain in force.
Among the city's monitoring stations, Gwalpahari saw the worst AQI with a 'poor' reading of 225. Vikas Sadan and Sector 51 recorded 117 and 146, respectively -- both 'moderate'. This data was unavailable at the Teri Gram monitoring station.
  BY TABOOLA
SPONSORED LINKS
YOU MAY LIKE
Get a ₹2CR LifeCover at ₹889/month today with Axis Max Life.
Axis Max Life Insurance
Get Quote
According to the System of Air Quality and Weather Forecasting and Research (Safar), the ventilation index (measure of the atmosphere's ability to disperse pollutants) is lower than the required 6000 m²/s. The average wind speed, less than 10 km/h, adds to poor pollutant dispersion.
""The predominant surface wind is likely to flow from the north with a speed of less than 4kmph during morning hours. Smog or moderate fog in most places and dense fog in isolated areas is likely in the morning. The wind speed may reach 8-10kmph from the northwest during the afternoon, but it will decrease and go below 6kmph during the evening and night,"" Safar stated.
The particulate matter levels remain highly concerning. Sector 51 recorded a PM2.5 level of 326 µg/m³, nearly 21 times higher than the World Health Organization's (WHO) safe limit of 15 µg/m³. It was followed by Gwalpahari (321 µg/m³) and Vikas Sadan at 253 µg/m³.
PM10 levels were also the worst at Gwalpahari at 177 µg/m³ — nearly four times WHO's safe threshold of 45 µg/m³. Sector 51 measured 169 µg/m³ and Vikas Sadan 144 µg/m³. Both the PM2.5 and PM10 were not recorded at Teri Gram.
The Central Pollution Control Board's (CPCB) annual safe limit is 60 µg/m³ for PM2.5 and 100 µg/m³ for PM10.
""Keeping in view its disruptive nature impacting a large number of stakeholders and public at large and with significant improvement in the average AQI also considering abrupt fluctuations in the meteorological factors, the GRAP sub-committee however decides to revoke Stage-IV of extant GRAP schedule in the entire NCR at this stage, with immediate effect,"" the CAQM order read."
15,Times of India,https://timesofindia.indiatimes.com/city/noida/aqi-improves-to-moderate-in-noida-and-ghaziabad/articleshow/117304680.cms,AQI improves to ‘moderate’ in Noida and Ghaziabad,,"Noida: The air quality improved significantly to ‘moderate' on Thursday following scattered showers across NCR on Wednesday night. Noida's AQI improved to 180 from 285 (poor), while Greater Noida saw a similar improvement at 133 against 222 a day ago. In neighbouring Ghaziabad, air quality improved notably to 195 (moderate) on Thursday from 316 (very poor) the day before.
Meanwhile, air monitoring stations across the two districts recorded AQI ranging from ‘satisfactory' to ‘poor' on Thursday.
In Noida, Sector 62 station recorded the worst AQI at 262 in the ‘poor' category, while Sector 1 (191), Sector 116 (163) and Sector 125 (137) all recorded ‘moderate' AQI. In Greater Noida, Knowledge Park 5 also recorded ‘moderate' AQI at 177, while Knowledge Park 3 recorded 98 in the ‘satisfactory' category.
In Ghaziabad, Indirapuram recorded ‘poor' AQI at 211, while Vasundhara recorded 191 in the ‘moderate' category. Data from the Sanjay Nagar and Loni stations was not available on Thursday.
  BY TABOOLA
SPONSORED LINKS
YOU MAY LIKE
How to Trade in Commodity Market's Like a Pro?
TradeWise
Learn More
As per a bulletin issued by the Indian Institute of Tropical Meteorology (IITM), on Thursday, the predominant surface wind came from the southeast direction with a wind speed of less than 6 kmph until evening. It decreased thereafter, becoming less than 4 kmph from the northeast direction during the night.
It stated that on Friday, the wind is likely to come from the north direction with a wind speed of less than 4 kmph during the morning hours. Smog and moderate fog are also likely in most places, with dense fog in a few places likely in the morning. The wind speed will gradually increase, becoming 8-10 kmph during the afternoon.
As per IMD data, the maximum and minimum temperatures were recorded at 19.6 degrees Celsius and 10.3 degrees Celsius on Thursday. The visibility ranged from zero to 200m in the morning hours in the region. The weather is likely to remain dry in western Uttar Pradesh on Friday."
16,Times of India,https://timesofindia.indiatimes.com/city/delhi/overnight-rains-lash-delhi-ncr-chill-intensifies-train-services-hit/articleshow/117281620.cms,"Overnight rains lash Delhi-NCR, chill intensifies, train services hit",,"NEW DELHI: Overnight rains intensified the chill in Delhi-NCR, with dense fog causing delays for at least 29 trains, which were running behind schedule.
A Met official stated, “There is a possibility of light rain on Thursday morning due to a western disturbance. Another round of light rain is expected on the night of January 21.”

The foggy, humid conditions have led to a sharp increase in air pollution, with levels reaching the ‘severe’ category by Wednesday evening.
  BY TABOOLA
SPONSORED LINKS
YOU MAY LIKE
Get a ₹2CR LifeCover at ₹889/month today with Axis Max Life.
Axis Max Life Insurance
Get Quote
As a result, the Commission for Air Quality Management (CAQM) reinstated curbs under GRAP-4, the highest pollution control measures, after a 22-day break. These measures include a ban on BS III petrol and BS IV diesel vehicles in Delhi and surrounding areas.
All construction activities, including linear public projects, have been suspended. Additionally, schools are now required to operate in hybrid mode, offering online classes as an option for students.
(With agency inputs)"
17,Times of India,https://timesofindia.indiatimes.com/india/fog-havoc-in-delhi-grap-4-back-as-air-turns-severe/articleshow/117280394.cms,"Fog havoc in Delhi, Grap-4 back as air turns severe",,"NEW DELHI: The capital experienced near-zero visibility conditions till close to noon on Wednesday, the season's most delayed lifting of dense fog that hit normal life and wreaked havoc on air, rail and road traffic in the region.
The foggy and humid conditions led to a sharp spike in air pollution, which crossed the 'severe' threshold by late evening, prompting the Commission for Air Quality Management (CAQM) to impose curbs under Grap-4, the highest pollution control measures that have been invoked after a gap of 22 days.
This brings back the ban on the plying of BS III petrol and BS IV diesel vehicles in Delhi and its neighbouring cities, and stops all construction activities, including linear public projects. It also mandates schools to operate in hybrid mode, giving the option of online classes to students.
Visibility dipped to zero from 8.30am to 11.30am, improving gradually in the subsequent hours.
  BY TABOOLA
SPONSORED LINKS
YOU MAY LIKE
She's is Revealing Her Secret Strategy in Commodity Trading
TradeWise
Learn More
Overcast skies pull max temp down sharply
Fog is expected to continue in the region, with the met department issuing a ‘yellow’ (be aware) alert for Thursday to Saturday for moderate to dense fog. Some areas received light rain in the evening.
R K Jenamani, senior IMD scientist, said visibility was in the range of 100-150 metres (dense fog) since 5.30am on Wednesday. “Dense fog intensified late morning on Wednesday with general visibility reducing to zero from 8.30am at both Safdarjung and IGI Airport. visibility dropped due to calm wind conditions and a stable surface atmospheric boundary layer. Easterly winds brought moisture which intensified the foggy conditions. Zero visibility with very dense fog conditions persisted at both Safdarjung and IGI Airport till 11.30 am,” said Jenamani.
This was the first time this season that dense fog had extended beyond 9.30am in the city, he said. By 12.30pm, visibility improved to 250-400 metres. Because of its persistence till late morning, Wednesday’s fog spell had a major impact on road, rail and air traffic. However, the most intense dense fog in terms of duration this season was recorded on Jan 4-5, which lasted for nearly nine hours from 11.30pm to 8.30am, according to IMD’s data.
Overcast skies during the day brought down the maximum temperature from 21.2 degrees Celsius on Tuesday to 18.1 degrees C, two notches below normal. The minimum temperature dipped to six degrees C, one degree below normal, compared to 8.9 degrees C a day earlier. Met department’s data shows that Palam, Pusa and Najafgarh recorded 0.5 mm rainfall each from 5.30pm to 8.30pm.
“There are chances of very light rain on Wednesday night and Thursday morning under the influence of a western disturbance. Another spell of very light to light rain is expected on Jan 21 night,” said a Met official. The fog spell is likely to continue."
